Symbol,Industry,Price,Previous Close,Volume average,Last trade time
BIONDVAX PHARMACEUTICALS LTD (XNAS:BVXV),Biotechnology & Medical Research,0.7,0.7,117880,7/10/2022 22:24
"BABCOCK & WILCOX ENTERPRISES, INC. (XNYS:BW)","Machinery, Equipment & Components",6.54,6.71,456488,7/10/2022 23:50
BORGWARNER INC. (XNYS:BWA),Automobiles & Auto Parts,33.6,34.24,1920679,7/10/2022 23:00
BETTER WORLD ACQUISITION CORP. (XNAS:BWAC),Holding Companies,10.38,10.37,2653,7/10/2022 20:00
BLUE WORLD ACQUISITION UNT (XNAS:BWAQU),#FIELD!,10.09,10.06,1920,6/10/2022 17:41
BRAINSWAY LTD (XNAS:BWAY),#FIELD!,3.52,3.61,31237,7/10/2022 20:00
"BRIDGEWATER BANCSHARES, INC. (XNAS:BWB)",Banking Services,16.61,16.89,45266,7/10/2022 20:01
"BRIDGEWATER BANCSHARES, INC. (XNAS:BWBBP)",Banking Services,21.48,21.31,2205,5/10/2022 20:00
Blue Whale Acquisition Corp I (XNAS:BWC),Holding Companies,9.69,9.7,118876,7/10/2022 20:00
BLUE WHALE ACQUISITION I UNT (XNAS:BWCAU),#FIELD!,9.7,9.67,313,3/10/2022 19:59
BROADWIND INC. (XNAS:BWEN),Renewable Energy,2.45,2.62,170445,7/10/2022 23:03
"BANKWELL FINANCIAL GROUP, INC. (XNAS:BWFG)",Banking Services,29.15,29.73,20665,7/10/2022 20:01
BrndywnGLB Glb Inc Oppts (XNYS:BWG),#FIELD!,7.88,7.92,43871,7/10/2022 23:00
BOWMAN CONSULTING GROUP LTD. (XNAS:BWMN),Construction & Engineering,15,15.48,21374,7/10/2022 20:00
Betterware de Mexico SAPI de CV (XNAS:BWMX),Diversified Retail,7,7.11,99519,7/10/2022 21:34
"BABCOCK & WILCOX ENTERPRISES, INC. (XNYS:BWNB)","Machinery, Equipment & Components",23.3,23.5,18016,7/10/2022 23:00
"BABCOCK & WILCOX ENTERPRISES, INC. (XNYS:BWSN)","Machinery, Equipment & Components",24.92,24.9,17049,7/10/2022 23:00
BLUE WATER VACCINES INC. (XNAS:BWV),Pharmaceuticals,1.7,1.77,502238,7/10/2022 23:55
"BWX TECHNOLOGIES, INC. (XNYS:BWXT)",Aerospace & Defense,52.16,52.64,505394,7/10/2022 23:00
Blackstone Inc (XNYS:BX),Investment Banking & Investment Services,86.38,91.61,4061547,7/10/2022 23:57
BLUELINX HOLDINGS INC. (XNYS:BXC),Homebuilding & Construction Supplies,67.96,70.67,135882,7/10/2022 23:00
"BLACKSTONE MORTGAGE TRUST, INC. (XNYS:BXMT)",Residential & Commercial REIT,22.64,23.1,2271422,7/10/2022 23:44
Nuveen SP500 Buy-Wr Inc (XNYS:BXMX),#FIELD!,12.16,12.43,175684,7/10/2022 23:00
"BOSTON PROPERTIES, INC. (XNYS:BXP)",Residential & Commercial REIT,71.31,73.42,1619403,7/10/2022 23:27
"Baudax Bio, Inc. (XNAS:BXRX)",Biotechnology & Medical Research,0.23,0.25,1845701,7/10/2022 23:45
Blackstone Secured Lending Fund (XNYS:BXSL),Investment Banking & Investment Services,23.06,23.27,648595,7/10/2022 23:00
"BYLINE BANCORP, INC. (XNYS:BY)",Banking Services,20.51,21,91266,7/10/2022 23:00
BOYD GAMING CORPORATION (XNYS:BYD),Hotels & Entertainment Services,51.18,52.29,1178674,7/10/2022 23:00
BROADWAY FINANCIAL CORPORATION (XNAS:BYFC),Banking Services,1.16,1.11,55358,7/10/2022 23:25
BlackRock Muni Inc Qly (XNYS:BYM),#FIELD!,11.04,11.07,87986,7/10/2022 23:00
Banyan Acquisition Corp (XNYS:BYN),Holding Companies,10.03,10.03,69199,7/10/2022 23:00
"BEYOND MEAT, INC. (XNAS:BYND)",Food & Tobacco,14.09,15.14,3987796,7/10/2022 23:59
BYNORDIC ACQUISITION CORPORATION (XNAS:BYNO),Holding Companies,9.97,10.06,5584,5/10/2022 20:00
BYRNA TECHNOLOGIES INC. (XNAS:BYRN),Aerospace & Defense,5.03,5.29,100445,7/10/2022 20:00
BEYONDSPRING INC. (XNAS:BYSI),Biotechnology & Medical Research,0.97,1.05,117866,7/10/2022 23:03
BYTE Acquisition Corp (XNAS:BYTS),Holding Companies,9.92,9.91,51410,7/10/2022 20:00
BYTE ACQUISITION UNT (XNAS:BYTSU),#FIELD!,9.94,9.93,2889,7/10/2022 19:17
Kanzhun Ltd (XNAS:BZ),Software & IT Services,16.64,18.34,1523827,7/10/2022 23:34
"BUZZFEED, INC (XNAS:BZFD)",Software & IT Services,1.7,1.72,188651,7/10/2022 20:19
"BEAZER HOMES USA, INC. (XNYS:BZH)",Homebuilding & Construction Supplies,10.54,11,509168,7/10/2022 23:00
BAOZUN INC. (XNAS:BZUN),Software & IT Services,5.91,6.26,374177,7/10/2022 20:27
CITIGROUP INC. (XNYS:C),Investment Banking & Investment Services,42.19,43.06,19157723,7/10/2022 23:58
Corporacion America Airports SA (XNYS:CAAP),Transport Infrastructure,7.24,7.12,93514,7/10/2022 23:48
"CHINA AUTOMOTIVE SYSTEMS, INC. (XNAS:CAAS)",Automobiles & Auto Parts,4.13,4.2,138905,7/10/2022 23:46
"Cabaletta Bio, Inc. (XNAS:CABA)",Biotechnology & Medical Research,0.69,0.72,662416,7/10/2022 23:54
"CABLE ONE, INC. (XNYS:CABO)",Telecommunications Services,816.63,844.45,58405,7/10/2022 23:37
CAMDEN NATIONAL CORPORATION (XNAS:CAC),Banking Services,40.82,42.36,32321,7/10/2022 20:01
CREDIT ACCEPTANCE CORPORATION (XNAS:CACC),Banking Services,443.32,457.8,75234,7/10/2022 20:00
CACI INTERNATIONAL INC. (XNYS:CACI),Software & IT Services,260.76,263.01,118908,7/10/2022 23:00
Cadence Bank (XNYS:CADE),Banking Services,26.47,26.93,1375971,7/10/2022 23:44
"CANDEL THERAPEUTICS, INC. (XNAS:CADL)",Biotechnology & Medical Research,3,3.17,21443,7/10/2022 20:02
CAE Inc. (XNYS:CAE),Aerospace & Defense,16.37,16.62,411453,7/10/2022 23:00
Morg Stan China A (XNYS:CAF),#FIELD!,14,14.15,14366,7/10/2022 23:00
"CONAGRA BRANDS, INC. (XNYS:CAG)",Food & Tobacco,32.85,32.56,3594981,7/10/2022 23:43
"CARDINAL HEALTH, INC. (XNYS:CAH)",Pharmaceuticals,68.22,69.44,3059499,7/10/2022 23:00
CANON INC. (XNYS:CAJ),Office Equipment,22.65,22.9,497603,7/10/2022 23:00
THE CHEESECAKE FACTORY INCORPORATED (XNAS:CAKE),Hotels & Entertainment Services,30.9,31.21,944757,7/10/2022 23:12
Caleres Inc. (XNYS:CAL),Specialty Retailers,24.78,25.42,607823,7/10/2022 23:00
"CALITHERA BIOSCIENCES, INC. (XNAS:CALA)",Pharmaceuticals,2.83,3.06,114667,7/10/2022 21:10
CALIFORNIA BANCORP (XNAS:CALB),Banking Services,20.52,20.61,2137,7/10/2022 20:00
"CAL-MAINE FOODS, INC. (XNAS:CALM)",Food & Tobacco,53.63,54.03,1117770,7/10/2022 23:42
Calliditas Therapeutics AB (XNAS:CALT),Pharmaceuticals,15,16.6,8306,7/10/2022 20:00
"CALIX, INC. (XNYS:CALX)",Communications & Networking,60.56,62.92,556986,7/10/2022 23:58
CALAMP CORP. (XNAS:CAMP),Telecommunications Services,4.02,4.26,1110069,7/10/2022 21:11
CAMTEK LTD (XNAS:CAMT),Semiconductors & Semiconductor Equipment,22.56,24.21,85036,7/10/2022 23:29
Canopy Holdings AS (XOSL:CAN),Software & IT Services,0.57,0.57,94660,7/10/2022 16:00
CAN B CORP. (OTCM:CANB),Food & Drug Retailing,3.04,3.35,1990,7/10/2022 18:48
Can-Fite Biopharma Ltd (XNYS:CANF),#FIELD!,0.78,0.78,53176,8/10/2022 0:00
CANGO INC. (XNYS:CANG),Software & IT Services,2.38,2.43,59749,7/10/2022 23:00
"CANO HEALTH, INC. (XNYS:CANO)",Healthcare Providers & Services,9.64,8.84,6040564,7/10/2022 23:59
BARCLAYS PLC (ARCX:CAPD),Banking Services,19.34,19.38,202762,8/10/2022 0:00
CROSSAMERICA PARTNERS UNT (XNYS:CAPL),#FIELD!,19.26,19.46,39376,7/10/2022 23:31
"CAPRICOR THERAPEUTICS, INC. (XNAS:CAPR)",Biotechnology & Medical Research,6.24,5.92,212697,7/10/2022 23:01
"AVIS BUDGET GROUP, INC. (XNAS:CAR)",Passenger Transportation Services,175.63,178.07,1257606,7/10/2022 23:58
"CARA THERAPEUTICS, INC. (XNAS:CARA)",Biotechnology & Medical Research,9.67,9.69,364112,7/10/2022 20:01
"Carter Bankshares, Inc. (XNAS:CARE)",Banking Services,16.1,16.34,66907,7/10/2022 20:01
"CARGURUS, INC. (XNAS:CARG)",Software & IT Services,13.99,14.56,1305719,7/10/2022 21:17
CARRIER GLOBAL CORPORATION (XNYS:CARR),"Machinery, Equipment & Components",35.33,37.21,4139330,7/10/2022 23:55
CARS.COM INC. (XNYS:CARS),Software & IT Services,11.93,12.17,478258,7/10/2022 23:00
"CARVER BANCORP, INC. (XNAS:CARV)",Banking Services,4.15,4.12,30020,7/10/2022 22:48
"CASA SYSTEMS, INC. (XNAS:CASA)",Communications & Networking,3.31,3.48,152291,7/10/2022 20:01
"Pathward Financial, Inc. (XNAS:CASH)",Banking Services,33.79,34.89,223275,7/10/2022 20:19
"CASI PHARMACEUTICALS, INC. (XNAS:CASI)",Pharmaceuticals,2.63,2.68,71072,7/10/2022 23:15
"CASS INFORMATION SYSTEMS, INC. (XNAS:CASS)",Professional & Commercial Services,35.52,36.07,32956,7/10/2022 20:02
"CASEY'S GENERAL STORES, INC. (XNAS:CASY)",Food & Drug Retailing,200.18,203.29,289492,7/10/2022 21:08
CATERPILLAR INC. (XNYS:CAT),"Machinery, Equipment & Components",177.55,178.81,2891989,7/10/2022 23:57
CAMBRIDGE BANCORP (XNAS:CATC),Banking Services,78.6,79.74,10695,7/10/2022 20:01
THE CATO CORPORATION (XNYS:CATO),Specialty Retailers,9.55,9.61,133440,7/10/2022 23:00
CATHAY GENERAL BANCORP (XNAS:CATY),Banking Services,40.71,41.17,302957,7/10/2022 20:01
"CB FINANCIAL SERVICES, INC. (XNAS:CBFV)",Banking Services,21.56,21.59,5490,7/10/2022 20:00
"COLONY BANKCORP, INC. (XNAS:CBAN)",Banking Services,13.25,13.55,42836,7/10/2022 20:01
"CBAK ENERGY TECHNOLOGY, INC. (XNAS:CBAT)","Machinery, Equipment & Components",1.18,1.2,208038,7/10/2022 23:33
"CYMABAY THERAPEUTICS, INC. (XNAS:CBAY)",Biotechnology & Medical Research,3.42,3.47,416214,7/10/2022 23:28
Companhia Brasileira de Distribuicao SA (XNYS:CBD),Food & Drug Retailing,3.68,3.74,970376,7/10/2022 23:00
"CB FINANCIAL SERVICES, INC. (XNAS:CBFV)",Banking Services,21.56,21.59,5490,7/10/2022 20:00
Vrts Convert & Inc 2024 (XNYS:CBH),#FIELD!,8.45,8.52,23474,7/10/2022 23:00
"CATALYST BIOSCIENCES, INC (XNAS:CBIO)",Biotechnology & Medical Research,0.54,0.56,1075859,7/10/2022 23:08
"CBL & ASSOCIATES PROPERTIES, INC. (XNYS:CBL)",Residential & Commercial REIT,24.71,24.75,157254,7/10/2022 23:00
"CAPITAL BANCORP, INC. (XNAS:CBNK)",Banking Services,24.02,24.2,20695,7/10/2022 20:01
"CBRE GROUP, INC. (XNYS:CBRE)",Real Estate Operations,69.43,71.67,1861794,7/10/2022 23:00
Chain Bridge I (XNAS:CBRG),Holding Companies,10.1,10.09,32608,5/10/2022 18:10
"Cracker Barrel Old Country Store, Inc. (XNAS:CBRL)",Hotels & Entertainment Services,91.45,95.01,539429,7/10/2022 23:09
"COMMERCE BANCSHARES, INC. (XNAS:CBSH)",Banking Services,69.18,70.44,393990,7/10/2022 20:08
CABOT CORPORATION (XNYS:CBT),Chemicals,62.63,64.36,423164,7/10/2022 23:00
"COMMUNITY BANK SYSTEM, INC. (XNYS:CBU)",Banking Services,60.6,62.13,234195,7/10/2022 23:00
"CBIZ, INC. (XNYS:CBZ)",Professional & Commercial Services,44.18,45.1,234179,7/10/2022 23:00
THE CHEMOURS COMPANY (XNYS:CC),Chemicals,26.37,26.93,2070040,7/10/2022 23:53
CASCADIA ACQUISITION CORP. (XNAS:CCAI),Holding Companies,9.87,9.86,14851,6/10/2022 20:00
CASCADIA ACQUISITION UNT (XNAS:CCAIU),#FIELD!,9.91,9.91,3361,7/10/2022 20:00
"CRESCENT CAPITAL BDC, INC. (XNAS:CCAP)",Collective Investments,13.58,14.1,86318,7/10/2022 21:13
COASTAL FINANCIAL CORPORATION (XNAS:CCB),Banking Services,39.16,39.82,34921,7/10/2022 20:01
"CAPITAL CITY BANK GROUP, INC. (XNAS:CCBG)",Banking Services,32.71,32.55,37888,7/10/2022 20:01
C4 Therapeutics Inc (XNAS:CCCC),Biotechnology & Medical Research,7.72,8.46,560901,7/10/2022 23:43
CCC INTELLIGENT SOLUTIONS HOLDINGS INC. (XNYS:CCCS),Software & IT Services,9.23,9.41,1250768,7/10/2022 23:00
Calamos Dyn Cv and Inc (XNAS:CCD),#FIELD!,21.32,21.72,103296,7/10/2022 20:00
"CRYO-CELL INTERNATIONAL, INC. (XNYS:CCEL)",Healthcare Providers & Services,5.25,5.57,9343,7/10/2022 20:27
COCA-COLA EUROPACIFIC PARTNERS PLC (XNAS:CCEP),Beverages,44.68,45.05,1588167,7/10/2022 21:47
CHASE CORPORATION (XNYS:CCF),"Machinery, Equipment & Components",82.89,86.09,21336,7/10/2022 21:39
CROWN CASTLE INC. (XNYS:CCI),Residential & Commercial REIT,134.35,137.7,1798327,7/10/2022 23:57
CAMECO CORPORATION (XNYS:CCJ),Uranium,26.7,26.82,6252112,7/10/2022 23:59
"CROWN HOLDINGS, INC. (XNYS:CCK)",Containers & Packaging,81.13,83.94,1607051,7/10/2022 23:00
CSI COMPRESSCO UNT (XNAS:CCLP),#FIELD!,1.33,1.37,29054,7/10/2022 21:17
Concord Medical Services Holdings Limited (XNYS:CCM),Healthcare Providers & Services,1.35,1.63,1892,7/10/2022 23:00
Code Chain New Continent Limited (XNAS:CCNC),Software & IT Services,0.21,0.25,2709787,7/10/2022 23:56
CNB FINANCIAL CORPORATION (XNAS:CCNE),Banking Services,23.66,24.18,75627,7/10/2022 20:01
CNB FINANCIAL CORPORATION (XNAS:CCNEP),Banking Services,26.15,25.3,1317,7/10/2022 14:39
"CLEAR CHANNEL OUTDOOR HOLDINGS, INC. (XNYS:CCO)",Media & Publishing,1.56,1.6,2223339,7/10/2022 23:00
"COGENT COMMUNICATIONS HOLDINGS, INC. (XNAS:CCOI)",Telecommunications Services,51.7,52.77,412972,7/10/2022 20:50
CoreCard Corporation (XNYS:CCRD),Financial Technology (Fintech) & Infrastructure,21.58,22.32,22889,7/10/2022 23:00
"CROSS COUNTRY HEALTHCARE, INC. (XNAS:CCRN)",Professional & Commercial Services,31.58,30.8,932365,7/10/2022 23:51
"CENTURY COMMUNITIES, INC. (XNYS:CCS)",Homebuilding & Construction Supplies,45.14,46.62,308235,7/10/2022 23:00
"CONSENSUS CLOUD SOLUTIONS, INC. (XNAS:CCSI)",Software & IT Services,47.41,49.29,127337,7/10/2022 20:28
Cactus Acquisition Corp. 1 Limited (XNAS:CCTS),Holding Companies,10.07,10.07,25722,7/10/2022 20:00
CACTUS ACQUISITION 1 UNT (XNAS:CCTSU),#FIELD!,10.07,10.07,369,3/10/2022 20:00
"UNITED BREWERIES COMPANY, INC (XNYS:CCU)",Beverages,10.74,11.12,356421,7/10/2022 23:00
Churchill Capital Corp V (XNYS:CCV),Holding Companies,9.95,9.93,158755,7/10/2022 23:00
Churchill Capital Corp VI (XNYS:CCVI),Holding Companies,9.85,9.86,197512,7/10/2022 23:00
"CHEMOCENTRYX, INC. (XNAS:CCXI)",Pharmaceuticals,51.86,51.85,1427523,7/10/2022 22:39
CHINDATA GROUP HOLDINGS LIMITED (XNAS:CD),Software & IT Services,7.92,8.18,2533259,7/10/2022 20:08
"CODIAK BIOSCIENCES, INC. (XNAS:CDAK)",Biotechnology & Medical Research,0.7,0.75,478834,7/10/2022 23:55
Compass Digital Acquisition Corp. (XNAS:CDAQ),Holding Companies,9.86,9.78,12721,7/10/2022 20:00
CERIDIAN HCM HOLDING INC. (XNYS:CDAY),Software & IT Services,59.64,62.29,1200789,7/10/2022 23:00
"COEUR MINING, INC. (XNYS:CDE)",Metals & Mining,3.5,3.81,6515630,7/10/2022 23:57
"CARDLYTICS, INC. (XNAS:CDLX)",Media & Publishing,8.83,9.18,462897,7/10/2022 20:01
"AVID BIOSERVICES, INC. (XNAS:CDMO)",Pharmaceuticals,18.01,18.65,684654,7/10/2022 20:02
"CAREDX, INC. (XNAS:CDNA)",Biotechnology & Medical Research,17.1,18,900338,7/10/2022 21:13
"CADENCE DESIGN SYSTEMS, INC. (XNAS:CDNS)",Software & IT Services,158.9,168.41,1848575,7/10/2022 23:25
CD PROJEKT S.A. (XWAR:CDR),Software & IT Services,116.22,116.22,1178040,7/10/2022 15:04
"CADRE HOLDINGS, INC. (XNYS:CDRE)",Aerospace & Defense,25.9,26.35,158618,7/10/2022 23:00
Codere Online Luxembourg SA (XNAS:CDRO),Hotels & Entertainment Services,2.51,2.92,13396,7/10/2022 19:59
"CIDARA THERAPEUTICS, INC. (XNAS:CDTX)",Biotechnology & Medical Research,0.64,0.65,246168,7/10/2022 23:23
CDW CORPORATION (XNAS:CDW),Software & IT Services,159.62,165,619749,7/10/2022 20:49
CHROMADEX CORPORATION (XNAS:CDXC),Biotechnology & Medical Research,1.28,1.37,146580,7/10/2022 20:00
"CODEXIS, INC. (XNAS:CDXS)",Biotechnology & Medical Research,5.4,5.88,674449,7/10/2022 22:28
CADIZ INC. (XNAS:CDZI),Water Utilities,1.68,1.9,131595,7/10/2022 20:00
CADIZ INC. (XNAS:CDZIP),Water Utilities,13.9,13.97,3950,7/10/2022 20:00
CELANESE CORPORATION (XNYS:CE),Chemicals,90.24,92.58,1223617,7/10/2022 23:00
CEA Industries Inc. (XNAS:CEAD),"Machinery, Equipment & Components",1.03,1.11,211390,7/10/2022 23:36
CEA Industries Inc. (XNAS:CEAD),"Machinery, Equipment & Components",1.03,1.11,211390,7/10/2022 23:36
CECO ENVIRONMENTAL CORP. (XNAS:CECE),Professional & Commercial Services,9.4,9.62,293806,7/10/2022 23:27
Central and Eastern Euro (XNYS:CEE),#FIELD!,6.38,6.62,30451,7/10/2022 23:00
CONSTELLATION ENERGY CORPORATION. (XNAS:CEG),Electrical Utilities & IPPs,84.39,86.28,2519635,7/10/2022 23:29
"CAMBER ENERGY, INC. (XNYS:CEI)",Oil & Gas,0.23,0.23,24433538,8/10/2022 0:00
CONSOL ENERGY INC. (XNYS:CEIX),Coal,70.3,71.68,548749,7/10/2022 23:00
CELCUITY INC. (XNAS:CELC),Biotechnology & Medical Research,10.04,10.35,49418,7/10/2022 20:00
"CELSIUS HOLDINGS, INC. (XNAS:CELH)",Beverages,85.57,89.65,1274148,7/10/2022 23:58
CELULARITY INC. (XNAS:CELU),Biotechnology & Medical Research,2.1,2.28,1074780,7/10/2022 20:55
"CREATIVE MEDICAL TECHNOLOGY HOLDINGS, INC. (XNAS:CELZ)",Biotechnology & Medical Research,0.46,0.52,223642,7/10/2022 22:35
ClearBridge MLP&Mdstrm (XNYS:CEM),#FIELD!,31.68,31.93,51342,7/10/2022 23:00
"CHEMBIO DIAGNOSTICS, INC. (XNAS:CEMI)",Pharmaceuticals,0.4,0.44,1030499,7/10/2022 23:24
Cntr Cst Brookfld MLP&EI (XNYS:CEN),#FIELD!,16.5,16.79,11590,7/10/2022 23:00
CENNTRO ELECTRIC GROUP LTD (XNAS:CENN),Automobiles & Auto Parts,0.92,0.99,2146851,7/10/2022 23:55
CENAQ ENERGY CORP. (XNAS:CENQ),Holding Companies,10.09,10.09,35376,6/10/2022 14:15
CENTRAL GARDEN & PET COMPANY (XNAS:CENT),Food & Tobacco,36.2,36.34,49356,7/10/2022 20:01
CENTRAL GARDEN & PET COMPANY (XNAS:CENTA),Food & Tobacco,34.35,34.58,177959,7/10/2022 20:02
CENTURY ALUMINUM COMPANY (XNAS:CENX),Metals & Mining,6.08,6.5,2270860,7/10/2022 23:28
Central Puerto SA (XNYS:CEPU),#FIELD!,4.39,4.48,205497,7/10/2022 23:00
CRESTWOOD EQUITY PARTNERS UNT (XNYS:CEQP),#FIELD!,28.9,29.13,740136,7/10/2022 23:00
"CEREVEL THERAPEUTICS HOLDINGS, INC. (XNAS:CERE)",Biotechnology & Medical Research,27.16,29.96,646933,7/10/2022 20:36
CERUS CORPORATION (XNAS:CERS),Healthcare Equipment & Supplies,3.61,3.8,1533575,7/10/2022 23:38
"CERTARA, INC. (XNAS:CERT)",Software & IT Services,13.11,13.63,767579,7/10/2022 20:41
Central Securities Corp (XNYS:CET),#FIELD!,34.85,35.19,17668,7/10/2022 20:10
CEMTREX INC. (XNAS:CETX),Professional & Commercial Services,0.21,0.22,144025,7/10/2022 23:39
CEMTREX INC. (XNAS:CETXP),Professional & Commercial Services,0.69,0.69,695,7/10/2022 17:48
Eaton Vance CA Muni Inc (XNYS:CEV),#FIELD!,9.6,9.64,25207,8/10/2022 0:00
"CEVA, INC (XNAS:CEVA)",Semiconductors & Semiconductor Equipment,26.79,28.46,98175,7/10/2022 20:01
"CF INDUSTRIES HOLDINGS, INC. (XNYS:CF)",Chemicals,104.8,105.73,2816813,7/10/2022 23:59
"CROSSFIRST BANKSHARES, INC. (XNAS:CFB)",Banking Services,12.89,13.27,96883,7/10/2022 20:02
CF BANKSHARES INC. (XNAS:CFBK),Banking Services,21.1,21.5,6280,7/10/2022 20:00
CF ACQUISITION CORP. VIII (XNAS:CFFE),Holding Companies,10.32,10.32,23695,7/10/2022 20:00
C&F FINANCIAL CORPORATION (XNAS:CFFI),Banking Services,54.86,55.5,7441,7/10/2022 20:00
"CAPITOL FEDERAL FINANCIAL, INC. (XNAS:CFFN)",Banking Services,8.25,8.43,548626,7/10/2022 20:01
CF Acquisition Corp VII (XNAS:CFFS),Holding Companies,9.97,10.03,42432,5/10/2022 20:00
CF ACQUISITION VII UNT (XNAS:CFFSU),#FIELD!,10.03,10.02,2875,9/30/2022 20:00
"CITIZENS FINANCIAL GROUP, INC. (XNYS:CFG)",Banking Services,35.02,35.43,4787072,7/10/2022 23:17
CF Acquisition Corp IV (XNAS:CFIV),Holding Companies,9.95,9.95,71016,7/10/2022 20:00
CF ACQUISITION IV UNT (XNAS:CFIVU),#FIELD!,9.95,9.95,7103,6/10/2022 19:17
"CONFLUENT, INC. (XNAS:CFLT)",Software & IT Services,24.83,27.6,2157646,7/10/2022 23:47
"CONFORMIS, INC. (XNAS:CFMS)",Healthcare Equipment & Supplies,0.2,0.2,439331,7/10/2022 23:43
"CULLEN/FROST BANKERS, INC. (XNYS:CFR)",Banking Services,138.47,139.81,482976,7/10/2022 23:00
CONTRAFECT CORPORATION (XNAS:CFRX),Biotechnology & Medical Research,0.16,0.17,1329205,7/10/2022 22:57
"CFSB BANCORP, INC. (XNAS:CFSB)",Banking Services,8.62,8.76,3414,7/10/2022 20:00
THE CARLYLE GROUP INC. (XNAS:CG),Investment Banking & Investment Services,26.67,27.64,2649140,7/10/2022 23:59
"CHINA GREEN AGRICULTURE, INC. (XNYS:CGA)",Chemicals,6.25,6.08,23354,7/10/2022 23:00
Carlyle Finance LLC (XNAS:CGABL),#FIELD!,17.31,17.49,30008,7/10/2022 20:00
Centerra Gold Inc. (XNYS:CGAU),Metals & Mining,4.67,4.92,223059,7/10/2022 23:00
"CARLYLE SECURED LENDING, INC. (XNAS:CGBD)",Banking Services,11.77,11.85,269823,7/10/2022 20:00
Canopy Growth Corporation (XNAS:CGC),Pharmaceuticals,2.79,3.75,8637182,8/10/2022 0:00
"CULLINAN ONCOLOGY, INC. (XNAS:CGEM)",Biotechnology & Medical Research,12.61,13,188446,7/10/2022 20:01
COMPUGEN LTD. (XNAS:CGEN),Biotechnology & Medical Research,0.58,0.69,1132002,7/10/2022 23:59
COGNYTE SOFTWARE LTD (XNAS:CGNT),Software & IT Services,3.34,3.74,867161,7/10/2022 23:23
COGNEX CORPORATION (XNAS:CGNX),"Machinery, Equipment & Components",42.93,44.83,1076257,7/10/2022 20:53
Calamos Glbl Tot Rtn (XNAS:CGO),#FIELD!,9.06,9.41,35238,7/10/2022 20:00
CAPSTONE GREEN ENERGY CORPORATION (XNAS:CGRN),"Machinery, Equipment & Components",1.76,1.72,126508,7/10/2022 23:51
"COGNITION THERAPEUTICS, INC. (XNAS:CGTX)",Biotechnology & Medical Research,1.93,1.98,78179,7/10/2022 20:00
CATCHA INVESTMENT CORP (XNYS:CHAA),Holding Companies,9.92,9.94,57982,7/10/2022 23:00
"COMSTOCK HOLDING COMPANIES, INC. (XNAS:CHCI)",Real Estate Operations,4.04,4.08,12433,7/10/2022 20:00
CITY HOLDING COMPANY (XNAS:CHCO),Banking Services,89.62,89.55,74894,7/10/2022 20:00
COMMUNITY HEALTHCARE TRUST INCORPORATED (XNYS:CHCT),Residential & Commercial REIT,31.24,31.97,111340,7/10/2022 23:00
"CHURCH & DWIGHT CO., INC. (XNYS:CHD)",Personal & Household Products & Services,70.72,71.82,1682675,7/10/2022 23:10
CHURCHILL DOWNS INCORPORATED (XNAS:CHDN),Hotels & Entertainment Services,196.1,197.63,191599,7/10/2022 21:02
CHEMED CORPORATION (XNYS:CHE),Healthcare Providers & Services,436.11,440.47,78714,7/10/2022 23:00
Chenghe Acquisition Co. (XNAS:CHEA),Holding Companies,10.09,10.07,12662,5/10/2022 20:00
"THE CHEFS' WAREHOUSE, INC. (XNAS:CHEF)",Food & Drug Retailing,30.61,30.64,395929,7/10/2022 20:00
CHECK-CAP LTD (XNAS:CHEK),Biotechnology & Medical Research,0.28,0.29,357022,7/10/2022 20:17
CORPHOUSING GROUP INC. (XNAS:CHG),Real Estate Operations,1.84,1.98,94542,7/10/2022 22:28
"CHEGG, INC. (XNYS:CHGG)",Professional & Commercial Services,21.1,22.04,1600673,7/10/2022 23:00
"CHOICE HOTELS INTERNATIONAL, INC. (XNYS:CHH)",Hotels & Entertainment Services,114.19,116.8,512195,7/10/2022 23:00
Calamos Conv Opp Inc (XNAS:CHI),#FIELD!,10.4,10.65,182054,7/10/2022 20:00
CHESAPEAKE ENERGY CORPORATION (XNAS:CHK),Oil & Gas,100.46,101.65,2061386,7/10/2022 23:30
CHECK POINT SOFTWARE TECHNOLOGIES LTD. (XNAS:CHKP),Software & IT Services,110.69,113.75,801195,7/10/2022 20:26
CHEMUNG FINANCIAL CORPORATION (XNAS:CHMG),Banking Services,41.21,41.99,8875,7/10/2022 20:00
CHERRY HILL MORTGAGE INVESTMENT CORPORATION (XNYS:CHMI),Residential & Commercial REIT,4.74,4.93,269523,7/10/2022 23:50
China Fund (XNYS:CHN),#FIELD!,11.76,12.02,9090,7/10/2022 23:00
"CHINA NATURAL GAS, INC. (OTCM:CHNGQ)",Oil & Gas Related Equipment and Services,0,0,100,9/26/2022 17:07
"CHINA NATURAL RESOURCES, INC. (XNAS:CHNR)",Water Utilities,0.49,0.49,16148,7/10/2022 20:00
"CHARGEPOINT HOLDINGS, INC. (XNYS:CHPT)",Electrical Utilities & IPPs,14.43,15.61,10737811,7/10/2022 23:59
"CHARAH SOLUTIONS, INC. (XNYS:CHRA)",Professional & Commercial Services,1.84,1.96,84361,7/10/2022 23:00
"CHARAH SOLUTIONS, INC. (XNYS:CHRB)",Professional & Commercial Services,20.4,20.5,13933,7/10/2022 23:00
CHORD ENERGY CORPORATION (XNAS:CHRD),Oil & Gas,148.46,150.76,450485,7/10/2022 23:20
"COHERUS BIOSCIENCES, INC. (XNAS:CHRS)",Biotechnology & Medical Research,8.76,9.73,1128070,7/10/2022 20:00
"C.H. ROBINSON WORLDWIDE, INC. (XNAS:CHRW)",Freight & Logistics Services,94.81,97.49,1384022,7/10/2022 23:50
"CHICO'S FAS, INC. (XNYS:CHS)",Specialty Retailers,4.95,5.01,2446489,7/10/2022 23:00
CHS Inc. (XNAS:CHSCL),Food & Tobacco,25.42,26.6,37744,7/10/2022 20:00
CHS Inc. (XNAS:CHSCM),Food & Tobacco,24.65,24.62,43271,7/10/2022 20:00
CHS Inc. (XNAS:CHSCN),Food & Tobacco,25.15,24.9,45977,7/10/2022 20:00
CHS Inc. (XNAS:CHSCO),Food & Tobacco,26.07,26.03,27352,7/10/2022 20:00
CHS Inc. (XNAS:CHSCP),Food & Tobacco,28.29,28.66,15798,7/10/2022 20:00
"Chunghwa Telecom Co., Ltd. (XNYS:CHT)",Telecommunications Services,34.23,34.49,245657,7/10/2022 23:00
"CHARTER COMMUNICATIONS, INC. (XNAS:CHTR)",Telecommunications Services,312.53,323.95,1679666,7/10/2022 22:14
"CHUY'S HOLDINGS, INC. (XNAS:CHUY)",Hotels & Entertainment Services,23.75,24.38,114524,7/10/2022 21:09
Calamos Glbl Dyn Inc (XNAS:CHW),#FIELD!,5.7,5.97,228886,7/10/2022 22:27
"CHEWY, INC. (XNYS:CHWY)",Specialty Retailers,36.34,37.94,4280923,7/10/2022 23:38
CHAMPIONX CORPORATION (XNAS:CHX),Oil & Gas Related Equipment and Services,21.34,21.76,1939610,7/10/2022 20:26
Calamos Conv & High Inc (XNAS:CHY),#FIELD!,10.83,11.07,164492,7/10/2022 20:00
CIGNA CORPORATION (XNYS:CI),Healthcare Providers & Services,288.38,293.08,2041295,7/10/2022 23:00
Bancolombia SA (XNYS:CIB),Banking Services,25.86,26.26,280691,7/10/2022 23:00
CINEDIGM CORP. (XNAS:CIDM),Media & Publishing,0.43,0.45,854370,7/10/2022 23:49
CIENA CORPORATION (XNYS:CIEN),Communications & Networking,40.59,41.93,2180357,7/10/2022 23:00
MFS Intmdt Hi Inc (XNYS:CIF),#FIELD!,1.74,1.76,52407,7/10/2022 23:00
CIPHER MINING INC. (XNAS:CIFR),Financial Technology (Fintech) & Infrastructure,1.14,1.27,330884,7/10/2022 23:18
ENERGY CO OF MINAS GERAIS (XNYS:CIG),Electrical Utilities & IPPs,2.09,2.15,6044291,7/10/2022 23:00
Colliers International Group Inc. (XNAS:CIGI),Real Estate Operations,90.49,93.35,106745,7/10/2022 20:00
CHINA INDEX HOLDINGS LIMITED (XNAS:CIH),Professional & Commercial Services,0.92,0.95,12723,7/10/2022 20:00
BlackRock En Capital&Inc (XNYS:CII),#FIELD!,16.78,17.15,89921,7/10/2022 23:00
"CIIG CAPITAL PARTNERS II, INC. (XNAS:CIIG)",Holding Companies,9.98,9.98,25157,7/10/2022 15:45
CIIG CAPITAL PARTNERS II UNT (XNAS:CIIGU),#FIELD!,9.99,9.97,1074,7/10/2022 20:00
Credit Suisse Income (XNYS:CIK),#FIELD!,2.56,2.59,226685,8/10/2022 0:00
CHIMERA INVESTMENT CORPORATION (XNYS:CIM),Residential & Commercial REIT,5.26,5.47,3871352,7/10/2022 23:47
"CINCOR PHARMA, INC. (XNAS:CINC)",Biotechnology & Medical Research,33.49,33.99,333775,7/10/2022 20:55
CINCINNATI FINANCIAL CORPORATION (XNAS:CINF),Insurance,93.94,95.57,848760,7/10/2022 20:03
CINGULATE INC. (XNAS:CING),Biotechnology & Medical Research,1.24,1.32,87815,7/10/2022 20:00
CI&T Inc (XNYS:CINT),Software & IT Services,10,10.31,65879,7/10/2022 23:00
"CITY OFFICE REIT, INC. (XNYS:CIO)",Residential & Commercial REIT,9.19,9.3,349496,7/10/2022 23:00
CION INVESTMENT CORPORATION (XNYS:CION),Investment Banking & Investment Services,8.48,8.75,267570,7/10/2022 23:00
"CIRCOR INTERNATIONAL, INC. (XNYS:CIR)","Machinery, Equipment & Components",17.69,19.14,171778,7/10/2022 23:00
CERBERUS CYBER SENTINEL CORPORATION (XNAS:CISO),Software & IT Services,2.82,3.22,127056,7/10/2022 22:36
Cartica Acquisition Corp (XNAS:CITE),Holding Companies,10.14,10.12,89294,6/10/2022 20:00
