Symbol,Industry,Price,Previous Close,Volume average,Last trade time
"IGM BIOSCIENCES, INC. (XNAS:IGMS)",Biotechnology & Medical Research,20.66,22.45,221886,7/10/2022 21:14
IGNYTE ACQUISITION CORP. (XNAS:IGNY),Holding Companies,10.01,10.04,7623,7/10/2022 20:00
CBRE Glbl RE Inc (XNYS:IGR),#FIELD!,5.74,5.76,472762,7/10/2022 23:00
INTERNATIONAL GAME TECHNOLOGY PLC (XNYS:IGT),Hotels & Entertainment Services,17.41,17.6,1392415,7/10/2022 23:00
INCEPTION GROWTH ACQUISITION LIMITED (XNAS:IGTA),Holding Companies,9.92,9.94,2448,7/10/2022 20:00
Ihuman Inc (XNYS:IH),Software & IT Services,1.93,1.73,5553,7/10/2022 23:00
Voya Em Mkts Hi Div Eqty (XNYS:IHD),#FIELD!,4.97,4.97,41058,7/10/2022 23:00
INTERCONTINENTAL HOTELS GROUP PLC (XNYS:IHG),Hotels & Entertainment Services,49.46,50.28,161459,7/10/2022 23:00
Invesco HI 2023 Tgt Term (XNYS:IHIT),#FIELD!,8.15,8.28,60493,7/10/2022 23:00
"IHEARTMEDIA, INC. (XNAS:IHRT)",Media & Publishing,7.43,7.74,795552,7/10/2022 23:55
IHS Holding Limited (XNYS:IHS),Telecommunications Services,5.71,5.79,375665,7/10/2022 23:00
INNSUITES HOSPITALITY TRUST (XNYS:IHT),Residential & Commercial REIT,1.94,1.94,4908,8/10/2022 0:00
Invesco HI 2024 Tgt Term (XNYS:IHTA),#FIELD!,7.71,8.07,18523,7/10/2022 23:00
Morg Stan India Inv (XNYS:IIF),#FIELD!,23.12,23.46,40319,7/10/2022 23:00
"INFORMATION SERVICES GROUP, INC. (XNAS:III)",Software & IT Services,4.78,4.94,165084,7/10/2022 20:50
INSU ACQUISITION CORP. III (XNAS:IIII),Holding Companies,9.97,9.97,28360,7/10/2022 20:29
INSU ACQUISITION III UNT (XNAS:IIIIU),#FIELD!,9.93,9.92,2588,3/10/2022 17:36
"INSTEEL INDUSTRIES, INC. (XNYS:IIIN)",Metals & Mining,27.44,28.14,105234,7/10/2022 23:00
"I3 VERTICALS, INC. (XNAS:IIIV)",Professional & Commercial Services,21.03,21.71,170399,7/10/2022 20:01
Invesco Val Muni Inc (XNYS:IIM),#FIELD!,11.57,11.69,114907,7/10/2022 23:00
INSPIRA TECHNOLOGIES OXY B.H.N LTD (XNAS:IINN),Healthcare Equipment & Supplies,1.5,1.53,44800,7/10/2022 20:55
"INNOVATIVE INDUSTRIAL PROPERTIES, INC. (XNYS:IIPR)",Residential & Commercial REIT,91.12,96.28,371593,7/10/2022 23:51
"IKENA ONCOLOGY, INC. (XNAS:IKNA)",Biotechnology & Medical Research,2.98,3.23,99660,7/10/2022 20:01
"INHIBIKASE THERAPEUTICS, INC. (XNAS:IKT)",Biotechnology & Medical Research,0.88,0.88,75294,7/10/2022 20:17
INTELLIGENT LIVING APPLICATION GROUP INC. (XNAS:ILAG),"Machinery, Equipment & Components",3.71,3.56,1600227,7/10/2022 23:59
"ILLUMINA, INC. (XNAS:ILMN)",Healthcare Equipment & Supplies,206.18,212.72,1936961,7/10/2022 23:58
INDUSTRIAL LOGISTICS PROPERTIES TRUST (XNAS:ILPT),Residential & Commercial REIT,4.6,4.83,1707842,7/10/2022 23:30
I-MAB (XNAS:IMAB),Pharmaceuticals,3.66,3.93,547435,7/10/2022 21:30
INTERNATIONAL MEDIA ACQUISITION CORP. (XNAS:IMAQ),Holding Companies,10.12,10.12,16053,7/10/2022 20:00
INTERNATIONAL MEDIA ACQUISITION UNT (XNAS:IMAQU),#FIELD!,10.18,10.15,10017,5/10/2022 20:00
IMAX CORPORATION (XNYS:IMAX),Media & Publishing,14.62,14.95,537158,7/10/2022 23:00
"iMedia Brands, Inc. (XNAS:IMBI)",Specialty Retailers,0.65,0.67,1253780,7/10/2022 23:59
"iMedia Brands, Inc. (XNAS:IMBIL)",Specialty Retailers,13.1,13.42,2491,7/10/2022 20:00
IM CANNABIS CORP. (XNAS:IMCC),Pharmaceuticals,0.44,0.45,280085,7/10/2022 23:11
IMMUNOCORE HOLDINGS PLC (XNAS:IMCR),Biotechnology & Medical Research,47.08,47.65,371670,7/10/2022 20:00
"IMMUNOGEN, INC. (XNAS:IMGN)",Biotechnology & Medical Research,5.56,5.59,2960899,7/10/2022 22:31
"IMAGO BIOSCIENCES, INC. (XNAS:IMGO)",Biotechnology & Medical Research,16.04,16.56,139314,7/10/2022 20:01
"IMPAC MORTGAGE HOLDINGS, INC. (XNYS:IMH)",Banking Services,0.3,0.31,33286,8/10/2022 0:00
"INGLES MARKETS, INCORPORATED (XNAS:IMKTA)",Food & Drug Retailing,82.1,82.17,95794,7/10/2022 20:01
IMMUTEP LIMITED (XNAS:IMMP),#FIELD!,1.71,1.75,64839,7/10/2022 20:00
IMMERSION CORPORATION (XNAS:IMMR),Software & IT Services,5.25,5.39,230666,7/10/2022 21:50
Immix Biopharma Inc (XNAS:IMMX),Biotechnology & Medical Research,1.3,1.38,36045,7/10/2022 21:34
"IMMUNOME, INC. (XNAS:IMNM)",Biotechnology & Medical Research,4.37,4.86,18571,7/10/2022 20:00
"IMUNON, INC. (XNAS:IMNN)",Biotechnology & Medical Research,1.6,1.68,38216,7/10/2022 20:00
ChipMOS TECHNOLOGIES INC. (XNAS:IMOS),Semiconductors & Semiconductor Equipment,18.64,19.34,43448,7/10/2022 22:26
IMPEL PHARMACEUTICALS INC. (XNAS:IMPL),Biotechnology & Medical Research,4.95,5.12,39830,7/10/2022 20:02
IMPERIAL PETROLEUM INC. (XNAS:IMPP),Renewable Energy,0.41,0.4,7506495,7/10/2022 23:59
IMPERIAL PETROLEUM INC. (XNAS:IMPPP),Renewable Energy,19,19.69,1353,7/10/2022 20:00
IMARA INC. (XNAS:IMRA),Biotechnology & Medical Research,2.33,2.35,6662178,7/10/2022 20:31
IMMURON LIMITED (XNAS:IMRN),#FIELD!,2.03,1.95,2686,7/10/2022 21:24
IMMUNEERING CORPORATION (XNAS:IMRX),Biotechnology & Medical Research,12.85,12.98,70528,7/10/2022 21:06
INTEGRATED MEDIA TECHNOLOGY LIMITED (XNAS:IMTE),Electronic Equipment & Parts,0.7,0.73,1896273,7/10/2022 22:45
Immatics NV (XNAS:IMTX),Biotechnology & Medical Research,10.09,10.38,274795,7/10/2022 20:00
"IMMUNIC, INC. (XNAS:IMUX)",Biotechnology & Medical Research,3.96,3.73,159103,7/10/2022 20:49
IMV INC. (XNAS:IMV),Biotechnology & Medical Research,0.49,0.48,92810,7/10/2022 22:59
"IMMUNOVANT, INC. (XNAS:IMVT)",Biotechnology & Medical Research,9.09,9.82,1560481,7/10/2022 23:58
"INTERNATIONAL MONEY EXPRESS, INC. (XNAS:IMXI)",Professional & Commercial Services,23.63,23.92,378076,7/10/2022 20:01
"IN8BIO, INC. (XNAS:INAB)",Biotechnology & Medical Research,2.08,2.15,252517,7/10/2022 20:00
INSIGHT ACQUISITION CORP. (XNYS:INAQ),Holding Companies,9.88,9.87,10047,4/10/2022 23:00
FIRST INTERNET BANCORP (XNAS:INBK),Banking Services,30.81,33.83,27255,7/10/2022 20:00
FIRST INTERNET BANCORP (XNAS:INBKZ),Banking Services,23.85,23.44,710,7/10/2022 16:35
"INHIBRX, INC. (XNAS:INBX)",Biotechnology & Medical Research,30.5,30.26,1009389,7/10/2022 23:44
INTERCURE LTD. (XNAS:INCR),Healthcare Providers & Services,4.8,4.83,60647,7/10/2022 21:25
INCYTE CORPORATION (XNAS:INCY),Pharmaceuticals,68.42,69.64,1327576,7/10/2022 23:59
INDEPENDENT BANK CORP. (XNAS:INDB),Banking Services,76.95,78.61,192016,7/10/2022 20:01
"INDIE SEMICONDUCTOR, INC. (XNAS:INDI)",Semiconductors & Semiconductor Equipment,7.67,7.8,1268693,7/10/2022 23:28
INDONESIA ENERGY CORPORATION LIMITED (XNYS:INDO),Oil & Gas,7.87,7.78,1433158,8/10/2022 0:00
"INDAPTUS THERAPEUTICS, INC. (XNAS:INDP)",Biotechnology & Medical Research,2.02,2.1,15019,7/10/2022 20:29
"INDUS REALTY TRUST, INC (XNAS:INDT)",Residential & Commercial REIT,49.66,51.34,41971,7/10/2022 20:10
Informatica Inc (XNYS:INFA),Software & IT Services,20.7,21.28,383155,7/10/2022 23:00
"INFINITY PHARMACEUTICALS, INC. (XNAS:INFI)",Biotechnology & Medical Research,1.15,1.26,358593,7/10/2022 20:01
INFINERA CORPORATION (XNAS:INFN),Communications & Networking,4.96,5.34,2167779,7/10/2022 21:51
"INFUSYSTEM HOLDINGS, INC. (XNYS:INFU)",Healthcare Equipment & Supplies,6.96,7.32,42479,8/10/2022 0:00
INFOSYS LIMITED (XNYS:INFY),Software & IT Services,17.06,17.48,11640131,7/10/2022 23:08
ING Groep NV (XNYS:ING),Banking Services,8.73,8.87,5485381,7/10/2022 23:31
"INOGEN, INC. (XNAS:INGN)",Healthcare Equipment & Supplies,22,23.14,171651,7/10/2022 20:01
INGREDION INCORPORATED (XNYS:INGR),Food & Tobacco,80.57,80.73,423003,7/10/2022 23:00
KludeIn I Acquisition Corp (XNAS:INKA),Holding Companies,10.08,10.06,6958,7/10/2022 20:00
KLUDEIN I ACQUISITION UNT (XNAS:INKAU),#FIELD!,10.01,10.06,27,1/9/2022 19:38
"MINK THERAPEUTICS, INC (XNAS:INKT)",Biotechnology & Medical Research,2.19,2.15,39115,7/10/2022 20:21
"INTELLINETICS, INC. (XNYS:INLX)",Software & IT Services,3.76,4,94951,7/10/2022 20:10
INMED PHARMACEUTICALS INC. (XNAS:INM),Biotechnology & Medical Research,7.73,7.95,2339174,7/10/2022 23:05
INMUNE BIO INC. (XNAS:INMB),Biotechnology & Medical Research,6.57,6.6,55947,7/10/2022 20:00
INMODE LTD (XNAS:INMD),Healthcare Equipment & Supplies,31.07,31.89,1231960,7/10/2022 23:54
"SUMMIT HOTEL PROPERTIES, INC. (XNYS:INN)",Residential & Commercial REIT,6.89,6.95,822694,7/10/2022 23:00
InnovAge Holding Corp. (XNAS:INNV),Healthcare Providers & Services,4.7,4.97,185985,7/10/2022 20:00
"INOVIO PHARMACEUTICALS, INC. (XNAS:INO)",Biotechnology & Medical Research,1.61,1.74,5487418,7/10/2022 23:58
INNODATA INC. (XNAS:INOD),Software & IT Services,3.41,3.31,53772,7/10/2022 20:24
INPIXON (XNAS:INPX),Software & IT Services,6.13,8.18,49242,7/10/2022 23:54
"INSPIRED ENTERTAINMENT, INC. (XNAS:INSE)",Software & IT Services,9.21,9.62,213002,7/10/2022 20:01
INSEEGO CORP. (XNAS:INSG),Communications & Networking,2.04,2.14,488411,7/10/2022 23:31
Insight Select Income (XNYS:INSI),#FIELD!,15.03,15.14,13009,7/10/2022 23:00
INSMED INCORPORATED (XNAS:INSM),Biotechnology & Medical Research,22.09,22.97,945240,7/10/2022 20:01
"INSPIRE MEDICAL SYSTEMS, INC. (XNYS:INSP)",Healthcare Equipment & Supplies,171.02,184.13,291670,7/10/2022 23:00
"INSTRUCTURE HOLDINGS, INC. (XNYS:INST)",Software & IT Services,21.89,22.2,254725,7/10/2022 23:00
"International Seaways, Inc. (XNYS:INSW)",Oil & Gas Related Equipment and Services,34.26,34.15,720168,7/10/2022 23:00
WORLD FUEL SERVICES CORPORATION (XNYS:INT),Oil & Gas,25.29,26.15,570187,7/10/2022 23:00
"INTAPP, INC. (XNAS:INTA)",Software & IT Services,19.42,20.58,126894,7/10/2022 20:46
INTEL CORPORATION (XNAS:INTC),Semiconductors & Semiconductor Equipment,25.72,27.18,41588623,7/10/2022 23:59
Integral Acquisition Corp 1 (XNAS:INTE),Holding Companies,9.92,9.91,9616,6/10/2022 20:00
THE INTERGROUP CORPORATION (XNAS:INTG),Hotels & Entertainment Services,49.5,51,1237,7/10/2022 20:00
"Inter & Co, Inc. (XNAS:INTR)",Banking Services,3.13,3.31,403131,7/10/2022 20:59
INTEST CORPORATION (XNYS:INTT),"Machinery, Equipment & Components",7.72,7.9,41147,8/10/2022 0:00
INTUIT INC. (XNAS:INTU),Financial Technology (Fintech) & Infrastructure,392.96,411.32,1589350,7/10/2022 23:48
INTRUSION INC. (XNAS:INTZ),Software & IT Services,5.33,5.44,39259,7/10/2022 23:00
"INUVO, INC. (XNYS:INUV)",Software & IT Services,0.41,0.42,248124,8/10/2022 0:00
"INNOVIVA, INC. (XNAS:INVA)",Pharmaceuticals,12.4,12.38,674324,7/10/2022 23:49
"IDENTIV, INC. (XNAS:INVE)",Electronic Equipment & Parts,12.69,13.39,61435,7/10/2022 20:01
INVITATION HOMES INC. (XNYS:INVH),Residential & Commercial REIT,32.35,33.7,10021086,7/10/2022 23:38
"INVO BIOSCIENCE, INC. (XNAS:INVO)",Healthcare Equipment & Supplies,1.32,1.4,36921,7/10/2022 23:03
INNOVIZ TECHNOLOGIES LTD (XNAS:INVZ),Semiconductors & Semiconductor Equipment,5.05,5.43,1736433,7/10/2022 23:22
"INOZYME PHARMA, INC. (XNAS:INZY)",Biotechnology & Medical Research,2.58,2.82,59478,7/10/2022 20:00
Innovative International Acquisition Corp. (XNAS:IOAC),Holding Companies,10.15,10.15,51330,7/10/2022 13:37
INNOVATIVE INTERNATIONAL UNT (XNAS:IOACU),#FIELD!,10.15,10.16,1199,7/10/2022 20:00
"IO BIOTECH, INC. (XNAS:IOBT)",Biotechnology & Medical Research,2.55,2.6,35808,7/10/2022 20:00
ASSURE HOLDINGS CORP (XNAS:IONM),Healthcare Providers & Services,0.72,0.68,156089,7/10/2022 20:00
"IONQ, INC. (XNYS:IONQ)",Software & IT Services,5.28,5.64,2752589,7/10/2022 23:55
IONEER LTD (XNAS:IONR),Metals & Mining,15.96,16.45,8734,7/10/2022 20:00
"IONIS PHARMACEUTICALS, INC. (XNAS:IONS)",Biotechnology & Medical Research,45.93,45.6,1173673,7/10/2022 21:16
"INCOME OPPORTUNITY REALTY INVESTORS, INC. (XNYS:IOR)",Real Estate Operations,12.5,12.6,5599,8/10/2022 0:00
INNOSPEC INC. (XNAS:IOSP),Chemicals,84.41,87.44,99366,7/10/2022 20:01
SAMSARA INC. (XNYS:IOT),Software & IT Services,13.11,13.67,1630742,7/10/2022 23:43
"IOVANCE BIOTHERAPEUTICS, INC. (XNAS:IOVA)",Biotechnology & Medical Research,9.77,9.95,2131536,7/10/2022 23:22
INTERNATIONAL PAPER COMPANY (XNYS:IP),Containers & Packaging,31.56,32.2,4073172,7/10/2022 23:00
IMMUNOPRECISE ANTIBODIES LTD. (XNAS:IPA),Pharmaceuticals,4.72,4.64,17323,7/10/2022 20:00
"INTER PARFUMS, INC. (XNAS:IPAR)",Personal & Household Products & Services,74.26,76.85,89313,7/10/2022 20:10
Inflection Point Acquisition Corp (XNAS:IPAX),Holding Companies,9.8,9.81,135045,7/10/2022 20:00
INFLECTION POINT ACQUISITION UNT (XNAS:IPAXU),#FIELD!,9.9,9.91,6217,6/10/2022 20:00
"PROFESSIONAL DIVERSITY NETWORK, INC. (XNAS:IPDN)",Software & IT Services,0.87,0.91,53194,7/10/2022 20:00
"THE INTERPUBLIC GROUP OF COMPANIES, INC. (XNYS:IPG)",Media & Publishing,26.47,26.93,3158095,7/10/2022 23:00
IPG PHOTONICS CORPORATION (XNAS:IPGP),Electronic Equipment & Parts,86.62,90.21,355929,7/10/2022 20:01
Innate Pharma SA (XNAS:IPHA),Biotechnology & Medical Research,2.08,2.12,12433,7/10/2022 20:00
"INTREPID POTASH, INC. (XNYS:IPI)",Chemicals,40.71,41.84,293704,7/10/2022 23:00
Social Capital Hedosophia Holdings Corp. IV (XNYS:IPOD),Holding Companies,10.03,10.02,1017238,7/10/2022 23:00
SOCIAL CAPITAL HEDOSOPHIA HOLDINGS CORP. VI (XNYS:IPOF),Holding Companies,10.04,10.02,3342287,7/10/2022 23:00
"CENTURY THERAPEUTICS, INC. (XNAS:IPSC)",Biotechnology & Medical Research,9.44,10.12,99224,7/10/2022 20:01
InterPrivate II Acquisition Corp (XNYS:IPVA),Holding Companies,9.84,9.84,14640,7/10/2022 23:00
InterPrivate III Financial Partners Inc (XNYS:IPVF),Holding Companies,9.84,9.81,21299,4/10/2022 23:00
InterPrivate IV InfraTech Partners Inc (XNAS:IPVI),Holding Companies,9.85,9.83,12345,6/10/2022 20:00
INTERPRIVATE IV INFRATECH UNT (XNAS:IPVIU),#FIELD!,9.84,9.83,5088,3/10/2022 20:00
IPOWER INC. (XNAS:IPW),Software & IT Services,0.69,0.74,45133,7/10/2022 21:19
IDEAL POWER INC. (XNAS:IPWR),Renewable Energy,10.35,11.24,15002,7/10/2022 20:00
IPERIONX LIMITED (XNAS:IPX),Metals & Mining,5.21,5.5,9509,7/10/2022 20:00
"iQIYI, Inc. (XNAS:IQ)",Software & IT Services,2.45,2.59,8004706,7/10/2022 23:59
Invesco Qual Muni Inc (XNYS:IQI),#FIELD!,9.29,9.27,157803,7/10/2022 23:00
INTELLIGENT MEDICINE ACQUISITION CORP. (XNAS:IQMD),Holding Companies,10.08,10.09,9326,7/10/2022 20:00
INTELLIGENT MEDICINE ACQUISITION UNT (XNAS:IQMDU),#FIELD!,10.08,10.08,1391,6/10/2022 20:00
IQVIA HOLDINGS INC (XNYS:IQV),Biotechnology & Medical Research,180.34,187.54,1087015,7/10/2022 23:00
INGERSOLL RAND INC. (XNYS:IR),"Machinery, Equipment & Components",45.65,47.01,2919412,7/10/2022 23:00
IRIS ACQUISITION CORP (XNAS:IRAA),Holding Companies,9.86,9.83,22450,7/10/2022 20:00
TRIBE CAPITAL GROWTH I UNT (XNAS:IRAAU),#FIELD!,9.81,9.82,5116,6/10/2022 19:56
IROBOT CORPORATION (XNAS:IRBT),Electronic Equipment & Parts,56.19,56.22,973871,7/10/2022 21:33
IRIDIUM COMMUNICATIONS INC. (XNAS:IRDM),Telecommunications Services,47.42,48.63,715637,7/10/2022 22:10
IRIS ENERGY LIMITED (XNAS:IREN),Software & IT Services,3.71,4.4,220957,7/10/2022 23:58
IRIDEX CORPORATION (XNAS:IRIX),Healthcare Equipment & Supplies,2.35,2.5,36960,7/10/2022 20:00
New Ireland Fund (XNYS:IRL),#FIELD!,6.77,6.89,10237,7/10/2022 23:00
IRON MOUNTAIN INCORPORATED (XNYS:IRM),Residential & Commercial REIT,45.65,46,2117708,7/10/2022 23:49
IRADIMED CORPORATION (XNAS:IRMD),Healthcare Equipment & Supplies,28.02,28.26,22132,7/10/2022 20:47
"IRONNET, INC. (XNYS:IRNT)",Software & IT Services,0.56,0.63,1570881,7/10/2022 23:53
"IF BANCORP, INC. (XNAS:IROQ)",Banking Services,19.47,19.35,3428,7/10/2022 20:00
Integrated Rail & Resources Acquisition Corp (XNYS:IRRX),Holding Companies,10.06,10.06,13149,7/10/2022 23:00
IRSA INVESTMENTS AND REPRESENTATIONS INC. (XNYS:IRS),Real Estate Operations,4.15,4.16,77104,7/10/2022 23:00
"INDEPENDENCE REALTY TRUST, INC (XNYS:IRT)",Residential & Commercial REIT,15.49,16.33,2346308,7/10/2022 23:21
"IRHYTHM TECHNOLOGIES, INC. (XNAS:IRTC)",Healthcare Equipment & Supplies,122.93,132.37,449638,7/10/2022 23:10
"IRONWOOD PHARMACEUTICALS, INC. (XNAS:IRWD)",Biotechnology & Medical Research,10.13,10.15,2351268,7/10/2022 20:10
"INFORMATION SERVICES GROUP, INC. (XNAS:III)",Software & IT Services,4.78,4.94,165084,7/10/2022 20:50
Iron Spark I Inc (XNAS:ISAA),Holding Companies,9.92,9.91,42520,7/10/2022 20:00
PGIM High Yield Bond (XNYS:ISD),#FIELD!,11.77,11.99,94883,7/10/2022 23:00
ISSUER DIRECT CORPORATION (XNYS:ISDR),Software & IT Services,19.93,20.1,4341,8/10/2022 0:00
"IVERIC bio, Inc. (XNAS:ISEE)",Biotechnology & Medical Research,20.34,21.09,11701180,7/10/2022 23:45
"Insignia Systems, Inc. (XNAS:ISIG)",Media & Publishing,5.85,5.98,8203,7/10/2022 20:00
ISOPLEXIS CORPORATION (XNAS:ISO),Healthcare Equipment & Supplies,1.75,1.88,52222,7/10/2022 20:54
iSpecimen Inc (XNAS:ISPC),Software & IT Services,1.55,1.66,795842,7/10/2022 23:59
INSPIRATO INCORPORATED (XNAS:ISPO),Hotels & Entertainment Services,2.5,2.48,445376,7/10/2022 20:57
"IsoRay, Inc. (XNYS:ISR)",Healthcare Equipment & Supplies,0.39,0.37,382069,7/10/2022 23:17
"INTUITIVE SURGICAL, INC. (XNAS:ISRG)",Healthcare Equipment & Supplies,188.68,197.7,1800231,7/10/2022 23:57
"INNOVATIVE SOLUTIONS AND SUPPORT, INC. (XNAS:ISSC)",Aerospace & Defense,8.7,8.84,110393,7/10/2022 20:00
INVESTAR HOLDING CORPORATION (XNAS:ISTR),Banking Services,20.31,19.81,9702,7/10/2022 20:00
"ISUN, INC. (XNAS:ISUN)",Construction & Engineering,2.14,2.24,127327,7/10/2022 20:00
"GARTNER, INC. (XNYS:IT)",Software & IT Services,294.01,300.76,548094,7/10/2022 23:00
"INDUSTRIAL TECH ACQUISITIONS II, INC. (XNAS:ITAQ)",Holding Companies,10.01,10.01,5268,7/10/2022 20:00
Itau Corpbanca (XNYS:ITCB),Banking Services,2.97,3.02,29701,7/10/2022 23:00
"INTRA-CELLULAR THERAPIES, INC. (XNAS:ITCI)",Biotechnology & Medical Research,47.94,47.15,684145,7/10/2022 23:10
INTEGER HOLDINGS CORPORATION (XNYS:ITGR),Healthcare Equipment & Supplies,51.34,55.28,244304,7/10/2022 23:00
"ITERIS, INC. (XNAS:ITI)",Communications & Networking,2.69,2.83,54192,7/10/2022 20:00
INVESTORS TITLE COMPANY (XNAS:ITIC),Insurance,136,138.06,4821,7/10/2022 20:03
"iTeos Therapeutics, Inc. (XNAS:ITOS)",Biotechnology & Medical Research,18.24,18.98,383359,7/10/2022 20:01
"IT Tech Packaging, Inc. (XNYS:ITP)",Paper & Forest Products,0.76,0.75,31962,8/10/2022 0:00
Itiquira Acquisition Corp. (XNAS:ITQ),Holding Companies,9.96,9.95,64859,7/10/2022 20:00
ITIQUIRA ACQUISITION UNT (XNAS:ITQRU),#FIELD!,9.96,9.94,1159,6/10/2022 20:00
Integra Resources Corp. (XNYS:ITRG),Metals & Mining,0.55,0.55,77232,7/10/2022 23:06
"ITRON, INC. (XNAS:ITRI)","Machinery, Equipment & Components",42.7,44.58,323760,7/10/2022 20:04
Iterum Therapeutics PLC (XNAS:ITRM),Biotechnology & Medical Research,1.83,1.91,93393,7/10/2022 23:53
ITURAN LOCATION AND CONTROL LTD. (XNAS:ITRN),Communications & Networking,22.82,22.88,17612,7/10/2022 20:00
ITT INC. (XNYS:ITT),"Machinery, Equipment & Components",69.47,71.72,373432,7/10/2022 23:00
Itau Unibanco Holding SA (XNYS:ITUB),Banking Services,5.56,5.58,42376157,7/10/2022 23:00
ILLINOIS TOOL WORKS INC. (XNYS:ITW),Consumer Goods Conglomerates,187.41,191.9,1216060,7/10/2022 23:00
Inventiva SA (XNAS:IVA),Biotechnology & Medical Research,7.05,4.08,14991,7/10/2022 23:59
"INTEVAC, INC. (XNAS:IVAC)",Aerospace & Defense,4.62,4.67,18383,7/10/2022 20:00
INVACARE CORPORATION (XNYS:IVC),Healthcare Equipment & Supplies,0.79,0.8,342078,7/10/2022 23:00
Investcorp India Acquisition Corp. (XNAS:IVCA),Holding Companies,10.06,10.08,58378,5/10/2022 13:36
Investcorp Europe Acquisition Corp I (XNAS:IVCB),Holding Companies,10.13,10.12,19422,7/10/2022 20:00
INVESTCORP EUROPE ACQUISITION I UNT (XNAS:IVCBU),#FIELD!,10.13,10.13,137,4/10/2022 20:00
Swiftmerge Acquisition Corp (XNAS:IVCP),Holding Companies,9.94,9.94,28787,6/10/2022 20:00
SWIFTMERGE ACQUISITION UNT (XNAS:IVCPU),#FIELD!,9.95,9.95,3198,7/10/2022 18:36
"IVEDA SOLUTIONS, INC. (XNAS:IVDA)",Integrated Hardware & Software,0.63,0.62,46450,7/10/2022 21:07
Delaware Ivy High IncOpp (XNYS:IVH),#FIELD!,10.27,10.38,51008,7/10/2022 23:00
INVESCO MORTGAGE CAPITAL INC. (XNYS:IVR),Residential & Commercial REIT,10.33,10.71,1102694,7/10/2022 23:58
INVENTRUST PROPERTIES CORP. (XNYS:IVT),Residential & Commercial REIT,21.72,21.74,252083,7/10/2022 23:00
"INVIVYD, INC (XNAS:IVVD)",Biotechnology & Medical Research,3.19,3.29,440589,7/10/2022 20:21
INVESCO LTD. (XNYS:IVZ),Investment Banking & Investment Services,14.37,14.97,5820634,7/10/2022 23:05
ORIX CORPORATION (XNYS:IX),Banking Services,72.46,73.25,50234,7/10/2022 23:00
IX Acquisition Corp. (XNAS:IXAQ),Holding Companies,9.95,9.95,24418,7/10/2022 20:00
IX ACQUISITION UNT (XNAS:IXAQU),#FIELD!,9.96,9.96,4000,6/10/2022 20:00
INCANNEX HEALTHCARE LIMITED (XNAS:IXHL),Pharmaceuticals,4.76,4.51,8790,7/10/2022 22:33
"IZEA WORLDWIDE, INC (XNAS:IZEA)",Software & IT Services,0.7,0.72,293896,7/10/2022 22:27
JACOBS SOLUTIONS INC. (XNYS:J),Construction & Engineering,112.39,113.78,545331,7/10/2022 23:00
JACK IN THE BOX INC. (XNAS:JACK),Hotels & Entertainment Services,74.75,75.4,381053,7/10/2022 20:00
"JAGUAR HEALTH, INC. (XNAS:JAGX)",Biotechnology & Medical Research,0.17,0.17,3586716,7/10/2022 23:44
"JAKKS PACIFIC, INC. (XNAS:JAKK)",Leisure Products,19.88,20.17,105749,7/10/2022 21:06
Jamf Holding Corp. (XNAS:JAMF),Software & IT Services,23.67,25.55,520665,7/10/2022 20:10
JANONE INC. (XNAS:JAN),Biotechnology & Medical Research,1.98,2.15,27547,7/10/2022 20:00
"JANUX THERAPEUTICS, INC. (XNAS:JANX)",Biotechnology & Medical Research,12.36,13.48,59283,7/10/2022 20:20
JUPITER ACQUISITION CORPORATION (XNAS:JAQC),Holding Companies,9.68,9.69,14698,7/10/2022 20:00
JUPITER ACQUISITION UNT (XNAS:JAQCU),#FIELD!,9.8,9.82,13766,7/10/2022 20:00
JATT ACQUISITION CORP (XNYS:JATT),Holding Companies,10.04,10.06,27840,5/10/2022 23:00
JAZZ PHARMACEUTICALS PUBLIC LIMITED COMPANY (XNAS:JAZZ),Pharmaceuticals,135.8,139.09,623300,7/10/2022 20:02
JBG SMITH PROPERTIES (XNYS:JBGS),Residential & Commercial REIT,17.76,18.18,1577588,7/10/2022 23:00
"J. B. HUNT TRANSPORT SERVICES, INC. (XNAS:JBHT)",Freight & Logistics Services,160.06,165.11,793182,7/10/2022 23:59
"JANUS INTERNATIONAL GROUP, INC. (XNYS:JBI)",Homebuilding & Construction Supplies,8.89,9.37,555815,7/10/2022 23:00
Goldman Sachs Capital I Securities-Backed Series 2004-6 Trust (XNYS:JBK),#FIELD!,25.45,25.45,534,4/10/2022 23:00
JABIL INC. (XNYS:JBL),Electronic Equipment & Parts,60.2,61.68,1216182,7/10/2022 23:07
JETBLUE AIRWAYS CORPORATION (XNAS:JBLU),Passenger Transportation Services,6.61,6.95,12603772,7/10/2022 23:59
"JOHN B. SANFILIPPO & SON, INC. (XNAS:JBSS)",Food & Tobacco,74.88,76.25,58780,7/10/2022 20:01
JOHN BEAN TECHNOLOGIES CORPORATION (XNYS:JBT),"Machinery, Equipment & Components",91.01,94.1,174823,7/10/2022 23:00
Nuveen Core Equity Alpha (XNYS:JCE),#FIELD!,15.72,13.96,103889,7/10/2022 23:00
JOHNSON CONTROLS INTERNATIONAL PLC (XNYS:JCI),"Machinery, Equipment & Components",50.44,52.45,3817260,7/10/2022 23:00
Jack Creek Investment Corp. (XNAS:JCIC),Holding Companies,9.95,9.93,83947,7/10/2022 20:00
JACK CREEK INVESTMENT UNT (XNAS:JCICU),#FIELD!,10.03,10.04,3997,7/10/2022 16:22
JE Cleantech Holdings Limited (XNAS:JCSE),"Machinery, Equipment & Components",0.82,0.85,107264,7/10/2022 23:59
JEWETT-CAMERON TRADING COMPANY LTD. (XNAS:JCTCF),Paper & Forest Products,5.02,5.02,5466,7/10/2022 20:00
"JD.COM, INC. (XNAS:JD)",Diversified Retail,49.91,51.66,5932038,7/10/2022 23:59
JEFFERIES FINANCIAL GROUP INC. (XNYS:JEF),Investment Banking & Investment Services,31.49,32.48,1612627,7/10/2022 23:00
"JELD-WEN HOLDING, INC. (XNYS:JELD)",Homebuilding & Construction Supplies,9.05,9.46,1486752,7/10/2022 23:00
Nuveen EM Dbt 2022 Tg Tr (XNYS:JEMD),#FIELD!,6.44,6.44,30221,7/10/2022 23:00
abrdn Japan Equity (XNYS:JEQ),#FIELD!,5.19,5.24,30467,7/10/2022 23:00
JEFFS' BRANDS LTD (XNAS:JFBR),Diversified Retail,0.97,1.02,430339,7/10/2022 21:07
JIAYIN GROUP INC. (XNAS:JFIN),Software & IT Services,2.25,2.33,22565,7/10/2022 21:18
Nuveen Float Rate Inc (XNYS:JFR),#FIELD!,8.13,8.23,173296,7/10/2022 23:00
9F Inc (XNAS:JFU),Investment Banking & Investment Services,0.21,0.22,124717,7/10/2022 23:11
AURORA MOBILE LIMITED (XNAS:JG),Software & IT Services,0.94,1,104040,7/10/2022 20:00
Jaguar Global Growth Corporation I (XNAS:JGGC),Holding Companies,10.18,10.02,22190,6/10/2022 20:00
JAGUAR GLOBAL GROWTH I UNT (XNAS:JGGCU),#FIELD!,10.01,10.01,445,6/10/2022 20:00
Nuveen Global High Inc (XNYS:JGH),#FIELD!,10.87,11.02,49488,7/10/2022 23:00
Nuveen CI 2023 Target (XNYS:JHAA),#FIELD!,9.02,8.99,10175,7/10/2022 23:00
JANUS HENDERSON GROUP PLC (XNYS:JHG),Investment Banking & Investment Services,20.66,20.97,1757971,7/10/2022 23:00
J Hancock Investors (XNYS:JHI),#FIELD!,12.21,12.38,19003,7/10/2022 23:00
J Hancock Income Sec (XNYS:JHS),#FIELD!,10.68,10.74,17601,7/10/2022 23:00
JAMES HARDIE INDUSTRIES PUBLIC LIMITED COMPANY (XNYS:JHX),Construction Materials,20.98,21.33,120801,7/10/2022 23:00
"J.JILL, INC. (XNYS:JILL)",Specialty Retailers,16.78,17.23,30039,7/10/2022 23:00
J & J SNACK FOODS CORP. (XNAS:JJSF),Food & Tobacco,129.92,128.72,73322,7/10/2022 20:00
"JACK HENRY & ASSOCIATES, INC. (XNAS:JKHY)",Software & IT Services,185.66,186.02,425271,7/10/2022 20:18
"JinkoSolar Holding Co., Ltd. (XNYS:JKS)",Renewable Energy,50.83,52.55,878818,7/10/2022 23:53
JONES LANG LASALLE INCORPORATED (XNYS:JLL),Real Estate Operations,157.17,163.83,374979,7/10/2022 23:00
Nuveen Mortgage and Inc (XNYS:JLS),#FIELD!,15.89,15.98,10689,7/10/2022 23:00
Maxpro Capital Acquisition Corp. (XNAS:JMAC),Holding Companies,10.13,10.1,2759,7/10/2022 20:00
MAXPRO CAPITAL ACQUISITION UNT (XNAS:JMACU),#FIELD!,10.33,10.44,96,3/10/2022 20:00
Jumia Technologies AG (XNYS:JMIA),Software & IT Services,5.74,6.04,2193632,7/10/2022 23:58
Nuveen Multi-Market (XNYS:JMM),#FIELD!,5.7,5.82,4849,7/10/2022 23:00
"John Marshall Bancorp, Inc. (XNAS:JMSB)",Banking Services,25.39,25.17,14556,7/10/2022 20:01
"JOUNCE THERAPEUTICS, INC. (XNAS:JNCE)",Biotechnology & Medical Research,2.19,2.4,254920,7/10/2022 20:01
JOHNSON & JOHNSON (XNYS:JNJ),Pharmaceuticals,160.2,161.91,7744534,7/10/2022 23:59
"JUNIPER NETWORKS, INC. (XNYS:JNPR)",Communications & Networking,26.74,27.54,3311158,7/10/2022 23:33
JOANN INC. (XNAS:JOAN),Specialty Retailers,5.73,6.27,169767,7/10/2022 22:26
GEE Group Inc. (XNYS:JOB),Professional & Commercial Services,0.66,0.65,344505,7/10/2022 23:51
