Symbol,Industry,Price,Previous Close,Volume average,Last trade time
"AGILENT TECHNOLOGIES, INC. (XNYS:A)",Healthcare Equipment & Supplies,127.44,132.18,1498319,7/10/2022 23:00
ALCOA CORPORATION (XNYS:AA),Metals & Mining,39.01,39.85,8030817,7/10/2022 23:57
ARES ACQUISITION CORPORATION (XNYS:AAC),Holding Companies,9.95,9.93,528953,7/10/2022 23:00
ATA Creativity Global (XNAS:AACG),Miscellaneous Educational Service Providers,1.89,1.96,25213,7/10/2022 20:00
ARMADA ACQUISITION CORP. I (XNAS:AACI),Holding Companies,9.93,9.93,7913,6/10/2022 20:00
ARMADA ACQUISITION I UNT (XNAS:AACIU),#FIELD!,10.12,10.05,1988,6/10/2022 20:00
"Aadi Bioscience, Inc. (XNAS:AADI)",Pharmaceuticals,13.61,14.3,152440,7/10/2022 21:44
Arlington Asset Investment Corp. (XNYS:AAIC),Investment Banking & Investment Services,2.73,2.82,63019,7/10/2022 23:00
AMERICAN AIRLINES GROUP INC. (XNAS:AAL),Passenger Transportation Services,12.18,12.73,33519830,7/10/2022 23:59
Altisource Asset Management Corporation (XNYS:AAMC),Real Estate Operations,14.66,16,5057,8/10/2022 0:00
ATLANTIC AMERICAN CORPORATION (XNAS:AAME),Insurance,2.75,2.83,3683,7/10/2022 20:00
"The Aaron's Company, Inc. (XNYS:AAN)",Banking Services,9.5,9.9,412636,7/10/2022 23:00
"APPLIED OPTOELECTRONICS, INC. (XNAS:AAOI)",Electronic Equipment & Parts,2.78,2.93,3812311,7/10/2022 20:00
"AAON, INC. (XNAS:AAON)","Machinery, Equipment & Components",53.14,55.25,149421,7/10/2022 22:06
"ADVANCE AUTO PARTS, INC. (XNYS:AAP)",Specialty Retailers,161.32,165.14,796229,7/10/2022 23:59
APPLE INC. (XNAS:AAPL),"Computers, Phones & Household Electronics",140.09,145.43,97391603,7/10/2022 23:59
ACCELERATE ACQUISITION CORP. (XNYS:AAQC),Holding Companies,9.83,9.85,59279,7/10/2022 23:00
"AMERICAN ASSETS TRUST, INC. (XNYS:AAT)",Residential & Commercial REIT,24.92,25.02,305945,7/10/2022 23:00
Autoscope Technologies Corporation (XNAS:AATC),"Machinery, Equipment & Components",4.45,4.51,10543,7/10/2022 22:43
Almaden Minerals Ltd. (XNYS:AAU),Metals & Mining,0.24,0.25,230262,7/10/2022 22:36
"ATLAS AIR WORLDWIDE HOLDINGS, INC. (XNAS:AAWW)",Freight & Logistics Services,98.18,98.1,853282,7/10/2022 20:26
Abb Ltd (XNYS:ABB),"Machinery, Equipment & Components",25.01,25.62,2124384,7/10/2022 23:00
ABBVIE INC. (XNYS:ABBV),Pharmaceuticals,138.76,140.29,5980450,7/10/2022 23:56
AMERISOURCEBERGEN CORPORATION (XNYS:ABC),Healthcare Equipment & Supplies,137.35,139.91,1062957,7/10/2022 23:00
AMERIS BANCORP (XNAS:ABCB),Banking Services,48.37,48.86,421289,7/10/2022 20:01
ABCELLERA BIOLOGICS INC. (XNAS:ABCL),Biotechnology & Medical Research,10.75,11.41,1632602,7/10/2022 23:51
ABCAM PLC (XNAS:ABCM),Pharmaceuticals,15.34,16.03,232985,7/10/2022 22:59
ABEONA THERAPEUTICS INC. (XNAS:ABEO),Biotechnology & Medical Research,4.41,3.52,207579,7/10/2022 23:59
Ambev SA (XNYS:ABEV),Beverages,2.89,3.05,30911208,7/10/2022 23:46
"ASBURY AUTOMOTIVE GROUP, INC. (XNYS:ABG)",Specialty Retailers,154.63,152.68,210631,7/10/2022 23:00
ABG Acquisition Corp I (XNAS:ABGI),Holding Companies,9.9,9.9,41170,7/10/2022 20:00
"ARCA BIOPHARMA, INC. (XNAS:ABIO)",Biotechnology & Medical Research,2.07,2.12,37723,7/10/2022 20:08
ABM INDUSTRIES INCORPORATED (XNYS:ABM),Professional & Commercial Services,40.55,41.85,395611,7/10/2022 23:00
"ABIOMED, INC. (XNAS:ABMD)",Healthcare Equipment & Supplies,257.09,267.21,300533,7/10/2022 20:11
"AIRBNB, INC. (XNAS:ABNB)",Software & IT Services,108.54,111.58,5693387,7/10/2022 23:59
"ACUMEN PHARMACEUTICALS, INC. (XNAS:ABOS)",Biotechnology & Medical Research,9.82,10.07,3295158,7/10/2022 23:59
"ARBOR REALTY TRUST, INC. (XNYS:ABR)",Residential & Commercial REIT,11.85,12.05,2405709,7/10/2022 23:36
ABSCI CORPORATION (XNAS:ABSI),Biotechnology & Medical Research,2.89,3.16,397710,7/10/2022 21:44
ABSOLUTE SOFTWARE CORPORATION (XNAS:ABST),Software & IT Services,11.55,11.97,108449,7/10/2022 20:00
ABBOTT LABORATORIES (XNYS:ABT),Healthcare Equipment & Supplies,101.79,102.45,5499160,7/10/2022 23:26
ARBUTUS BIOPHARMA CORPORATION (XNAS:ABUS),Pharmaceuticals,1.91,1.99,706421,7/10/2022 23:59
"ABVC BIOPHARMA, INC. (XNAS:ABVC)",Biotechnology & Medical Research,0.88,0.91,92377,7/10/2022 20:00
"ARCOSA, INC. (XNYS:ACA)",Construction & Engineering,61.25,62.29,194164,7/10/2022 23:00
ATLANTIC COASTAL ACQUISITION CORP. II (XNAS:ACAB),Holding Companies,10.03,10.03,30677,7/10/2022 20:00
ATLANTIC COASTAL ACQUISITION II UNT (XNAS:ACABU),#FIELD!,10.1,10.02,302,7/10/2022 20:00
ACRI CAPITAL ACQUISITION CORPORATION (XNAS:ACAC),Holding Companies,9.97,9.97,191,4/10/2022 20:00
ACRI CAPITAL ACQUISITION UNT (XNAS:ACACU),#FIELD!,9.95,10.02,0,5/10/2022 20:00
ACADIA PHARMACEUTICALS INC. (XNAS:ACAD),Biotechnology & Medical Research,16.29,18.63,1544914,7/10/2022 22:07
ATLANTIC COASTAL ACQUISITION CORP. (XNAS:ACAH),Holding Companies,9.85,9.84,44057,7/10/2022 16:36
ATLANTIC COASTAL ACQUISITION UNT (XNAS:ACAHU),#FIELD!,9.82,9.88,369,3/10/2022 19:59
ATHENA CONSUMER ACQUISITION CORP. (XNYS:ACAQ),Holding Companies,10.06,10.06,10683,7/10/2022 23:00
ALSET CAPITAL ACQUISITION CORP. (XNAS:ACAX),Holding Companies,9.89,9.89,16378,5/10/2022 20:00
Aurora Cannabis Inc. (XNAS:ACB),Pharmaceuticals,1.16,1.33,9936452,7/10/2022 23:59
ACE GLOBAL BUSINESS ACQUISITION LIMITED (XNAS:ACBA),Holding Companies,10.5,10.45,6947,7/10/2022 20:00
Accolade Inc (XNAS:ACCD),Healthcare Providers & Services,11.48,12.39,737565,7/10/2022 23:40
ACCO BRANDS CORPORATION (XNYS:ACCO),Professional & Commercial Services,4.97,5.21,719005,7/10/2022 23:00
ASCENDANT DIGITAL ACQUISITION CORP. III (XNYS:ACDI),Holding Companies,10.14,10.16,37316,7/10/2022 23:00
"ACCEL ENTERTAINMENT, INC. (XNYS:ACEL)",Hotels & Entertainment Services,8.45,8.46,318799,7/10/2022 23:36
ACER THERAPEUTICS INC. (XNAS:ACER),Biotechnology & Medical Research,1.38,1.38,75562,7/10/2022 22:16
"ADICET BIO, INC. (XNAS:ACET)",Biotechnology & Medical Research,14.9,15.7,649649,7/10/2022 22:15
ACE CONVERGENCE ACQUISITION CORP. (XNAS:ACEV),Holding Companies,10.3,10.27,26923,7/10/2022 21:08
ACE CONVERGENCE ACQUISITION UNT (XNAS:ACEVU),#FIELD!,10.29,10.28,91,5/10/2022 20:00
ARCH CAPITAL GROUP LTD. (XNAS:ACGL),Insurance,45.67,48,1665567,7/10/2022 23:59
ARCH CAPITAL GROUP LTD. (XNAS:ACGLN),Insurance,18.66,18.82,52048,7/10/2022 20:00
ARCH CAPITAL GROUP LTD. (XNAS:ACGLO),Insurance,21.39,21.58,21383,7/10/2022 19:59
"ACADIA HEALTHCARE COMPANY, INC. (XNAS:ACHC)",Healthcare Providers & Services,80.17,82.78,591472,7/10/2022 23:59
ACHILLES THERAPEUTICS PLC (XNAS:ACHL),Biotechnology & Medical Research,2.21,2.27,23741,7/10/2022 20:02
ARCHER AVIATION INC. (XNYS:ACHR),Aerospace & Defense,2.64,2.86,1613086,7/10/2022 23:00
"ACHIEVE LIFE SCIENCES, INC. (XNAS:ACHV)",Biotechnology & Medical Research,3.31,3.38,27143,7/10/2022 22:16
"ACI WORLDWIDE, INC. (XNAS:ACIW)",Financial Technology (Fintech) & Infrastructure,21.93,22.12,908139,7/10/2022 22:36
ATLAS CREST INVESTMENT CORP. II (XNYS:ACII),Holding Companies,9.88,9.88,77740,7/10/2022 23:00
AC Immune Ltd (XNAS:ACIU),Biotechnology & Medical Research,2.75,3.12,73815,7/10/2022 20:00
"ACI WORLDWIDE, INC. (XNAS:ACIW)",Financial Technology (Fintech) & Infrastructure,21.93,22.12,908139,7/10/2022 22:36
"AXCELIS TECHNOLOGIES, INC. (XNAS:ACLS)",Semiconductors & Semiconductor Equipment,61.46,66.48,361177,7/10/2022 23:57
"ARCELLX, INC. (XNAS:ACLX)",Biotechnology & Medical Research,17.18,18.49,696091,7/10/2022 20:01
AECOM (XNYS:ACM),Construction & Engineering,72.09,73.14,672706,7/10/2022 23:00
"ACM RESEARCH, INC. (XNAS:ACMR)",Semiconductors & Semiconductor Equipment,12.3,13.24,404648,7/10/2022 22:09
ACCENTURE PUBLIC LIMITED COMPANY (XNYS:ACN),Software & IT Services,259.71,269.47,2407029,7/10/2022 23:35
ACNB CORPORATION (XNAS:ACNB),Banking Services,29.49,30.32,15087,7/10/2022 20:01
ASCENT INDUSTRIES CO. (XNAS:ACNT),Metals & Mining,13.54,14.39,15366,7/10/2022 20:00
"Aclarion, Inc. (XNAS:ACON)",Biotechnology & Medical Research,0.88,0.8,97296,7/10/2022 21:32
"ACORDA THERAPEUTICS, INC. (XNAS:ACOR)",Biotechnology & Medical Research,0.37,0.37,473055,7/10/2022 23:07
abrdn Inc Credit Str (XNYS:ACP),#FIELD!,6.42,6.56,112342,7/10/2022 23:00
Independence Holdings Corp. (XNAS:ACQR),Holding Companies,9.94,9.94,135426,7/10/2022 20:00
INDEPENDENCE HOLDINGS UNT (XNAS:ACQRU),#FIELD!,9.93,9.93,4847,6/10/2022 20:00
ACRES COMMERCIAL REALTY CORP. (XNYS:ACR),Residential & Commercial REIT,8.53,8.75,13566,7/10/2022 23:00
ARES COMMERCIAL REAL ESTATE CORPORATION (XNYS:ACRE),Residential & Commercial REIT,10.55,10.68,736481,7/10/2022 23:52
Acropolis Infrastructure Acquisition Corp (XNYS:ACRO),Holding Companies,9.75,9.73,322638,7/10/2022 23:00
"ACLARIS THERAPEUTICS, INC. (XNAS:ACRS)",Biotechnology & Medical Research,15.82,16.7,367533,7/10/2022 22:10
"ACELRX PHARMACEUTICALS, INC. (XNAS:ACRX)",Biotechnology & Medical Research,0.2,0.21,1527495,7/10/2022 22:48
Acasti Pharma Inc. (XNAS:ACST),Pharmaceuticals,0.57,0.58,57014,7/10/2022 23:47
"ENACT HOLDINGS, INC. (XNAS:ACT)",Insurance,23.15,23.47,317116,7/10/2022 23:56
ACACIA RESEARCH CORPORATION (XNAS:ACTG),Professional & Commercial Services,3.99,4.09,147588,7/10/2022 21:41
ACME UNITED CORPORATION (XNYS:ACU),Professional & Commercial Services,23.8,24.01,7151,7/10/2022 20:10
Vrts Div Inc & Conv (XNYS:ACV),#FIELD!,18.67,19,41476,7/10/2022 23:00
ACV AUCTIONS INC. (XNAS:ACVA),Software & IT Services,8.58,8.79,1482802,7/10/2022 23:33
"ACURX PHARMACEUTICALS, INC. (XNAS:ACXP)",Biotechnology & Medical Research,3.4,3.2,27102,7/10/2022 20:00
Adagene Inc (XNAS:ADAG),Biotechnology & Medical Research,1.39,1.38,24009,7/10/2022 20:00
Anthemis Digital Acquisitions I Corp (XNAS:ADAL),Holding Companies,10.13,10.09,70904,7/10/2022 20:00
ANTHEMIS DIGITAL ACQUISITIONS I UNT (XNAS:ADALU),#FIELD!,10.13,10.13,300,6/10/2022 19:59
ADAPTIMMUNE THERAPEUTICS PLC (XNAS:ADAP),Biotechnology & Medical Research,1.2,1.12,374761,7/10/2022 23:59
ADOBE INC. (XNAS:ADBE),Software & IT Services,288.77,298.41,5639362,7/10/2022 23:59
AGREE REALTY CORPORATION (XNYS:ADC),Residential & Commercial REIT,64.91,64.28,1073202,7/10/2022 23:00
ADC Therapeutics Ltd (XNYS:ADCT),Biotechnology & Medical Research,4.76,5.01,231662,7/10/2022 23:00
ADEIA INC. (XNAS:ADEA),Software & IT Services,9.36,8.82,868445,7/10/2022 23:55
26 Capital Acquisition Corp (XNAS:ADER),Holding Companies,9.86,9.86,37066,7/10/2022 20:00
"ADVANCED EMISSIONS SOLUTIONS, INC. (XNAS:ADES)",Professional & Commercial Services,2.74,2.91,86852,7/10/2022 22:46
ADIT EDTECH ACQUISITION CORP. (XNYS:ADEX),Holding Companies,9.91,9.9,85328,7/10/2022 23:00
"ANALOG DEVICES, INC. (XNAS:ADI)",Semiconductors & Semiconductor Equipment,144.92,150.97,3326742,7/10/2022 23:15
"ADIAL PHARMACEUTICALS, INC. (XNAS:ADIL)",Biotechnology & Medical Research,0.35,0.36,208981,7/10/2022 21:28
ARCHER-DANIELS-MIDLAND COMPANY (XNYS:ADM),Food & Tobacco,85.44,85.75,2892437,7/10/2022 23:30
"ADMA BIOLOGICS, INC. (XNAS:ADMA)",Pharmaceuticals,2.61,2.62,3516941,7/10/2022 23:41
ADAMIS PHARMACEUTICALS CORPORATION (XNAS:ADMP),Pharmaceuticals,0.13,0.14,1156076,7/10/2022 23:31
"ADVENT TECHNOLOGIES HOLDINGS, INC. (XNAS:ADN)",Renewable Energy,2.54,2.78,1103291,7/10/2022 23:48
ADIENT PUBLIC LIMITED COMPANY (XNYS:ADNT),Automobiles & Auto Parts,29.61,31.1,700121,7/10/2022 23:00
Edoc Acquisition Corp. (XNAS:ADOC),Holding Companies,10.28,10.3,1146,6/10/2022 20:00
"AUTOMATIC DATA PROCESSING, INC. (XNAS:ADP)",Software & IT Services,227.12,234.89,1970734,7/10/2022 23:54
ADAPTIVE BIOTECHNOLOGIES CORPORATION (XNAS:ADPT),Biotechnology & Medical Research,7.15,7.85,1062330,7/10/2022 22:11
ADARA ACQUISITION CORP. (XNYS:ADRA),Holding Companies,9.95,9.95,32934,7/10/2022 20:10
AULT DISRUPTIVE TECHNOLOGIES CORPORATION (XNYS:ADRT),Holding Companies,10.11,10.12,8007,5/10/2022 20:00
ADS-TEC ENERGY PUBLIC LIMITED COMPANY (XNAS:ADSE),Software & IT Services,6.25,6.69,12149,7/10/2022 20:00
"AUTODESK, INC. (XNAS:ADSK)",Software & IT Services,194.74,205.87,1506761,7/10/2022 23:34
ADT INC. (XNYS:ADT),Communications & Networking,8.29,8.42,3630157,7/10/2022 23:38
"ADTHEORENT HOLDING COMPANY, INC. (XNAS:ADTH)",Software & IT Services,1.93,1.88,297477,7/10/2022 22:21
"ADTRAN HOLDINGS, INC. (XNAS:ADTN)",Communications & Networking,20.52,20.22,917986,7/10/2022 22:22
"Aditxt, Inc. (XNAS:ADTX)",Biotechnology & Medical Research,3.64,3.31,4731140,8/10/2022 0:00
ADDUS HOMECARE CORPORATION (XNAS:ADUS),Healthcare Providers & Services,97.09,97.89,110792,7/10/2022 20:01
ADVA Optical Networking SE (XETR:ADV),Communications & Networking,19.34,19.35,19000,7/10/2022 18:30
"ADVERUM BIOTECHNOLOGIES, INC. (XNAS:ADVM)",Biotechnology & Medical Research,0.98,1.02,482067,7/10/2022 20:09
Addex Therapeutics Ltd (XNAS:ADXN),Biotechnology & Medical Research,0.79,0.75,87288,7/10/2022 20:13
"ADAMS RESOURCES & ENERGY, INC. (XNYS:AE)",Oil & Gas,30.62,30.52,12637,7/10/2022 20:10
Authentic Equity Acquisition Corp (XNAS:AEAC),Holding Companies,9.96,9.96,39972,7/10/2022 20:00
AUTHENTIC EQUITY ACQUISITION UNT (XNAS:AEACU),#FIELD!,9.97,9.96,1843,7/10/2022 20:00
ALTENERGY ACQUISITION CORP. (XNAS:AEAE),Holding Companies,9.98,9.99,19104,7/10/2022 20:00
abrdn Emg Mkts Eq Inc (XNYS:AEF),#FIELD!,4.7,4.82,48852,7/10/2022 20:10
Aegon Funding Company LLC (XNYS:AEFC),Banking Services,20.55,20.8,52464,7/10/2022 23:00
Aegon NV (XNYS:AEG),Insurance,4.11,4.17,2564668,7/10/2022 23:00
AESTHER HEALTHCARE ACQUISITION CORP. (XNAS:AEHA),Holding Companies,10.2,10.2,7181,6/10/2022 19:56
Antelope Enterprise Holdings Ltd (XNAS:AEHL),Homebuilding & Construction Supplies,0.57,0.58,279750,7/10/2022 23:47
AEHR TEST SYSTEMS (XNAS:AEHR),Semiconductors & Semiconductor Equipment,17.19,13.87,1083470,7/10/2022 23:59
ALSET INC. (XNAS:AEI),Construction & Engineering,0.22,0.23,776206,7/10/2022 23:57
"ADVANCED ENERGY INDUSTRIES, INC. (XNAS:AEIS)","Machinery, Equipment & Components",78.08,83.15,143370,7/10/2022 20:00
AMERICAN EQUITY INVESTMENT LIFE HOLDING COMPANY (XNYS:AEL),Insurance,38.99,39.41,637122,7/10/2022 23:00
AGNICO EAGLE MINES LIMITED (XNYS:AEM),Metals & Mining,42.64,45.13,3129008,7/10/2022 23:59
"AETHLON MEDICAL, INC. (XNAS:AEMD)",Healthcare Equipment & Supplies,0.63,0.67,279404,7/10/2022 23:23
Aenza SAA (XNYS:AENZ),Construction & Engineering,0.78,0.77,7320,7/10/2022 23:43
"AMERICAN EAGLE OUTFITTERS, INC. (XNYS:AEO)",Specialty Retailers,10.5,10.79,8589764,7/10/2022 23:12
"AMERICAN ELECTRIC POWER COMPANY, INC. (XNAS:AEP)",Electrical Utilities & IPPs,82.99,84.51,3185329,7/10/2022 23:23
AMERICAN ELEC PWR UNT (XNAS:AEPPZ),#FIELD!,48.35,49.16,127726,7/10/2022 20:00
AerCap Holdings NV (XNYS:AER),Professional & Commercial Services,47.19,47.67,1002705,7/10/2022 23:00
"AEROCLEAN TECHNOLOGIES, INC. (XNAS:AERC)",Professional & Commercial Services,3.43,4.09,3511419,7/10/2022 23:59
"AERIE PHARMACEUTICALS, INC. (XNAS:AERI)",Pharmaceuticals,15.2,15.16,1220471,7/10/2022 22:13
THE AES CORPORATION (XNYS:AES),Electrical Utilities & IPPs,24.92,25.4,5907163,7/10/2022 23:00
AES UNT (XNYS:AESC),#FIELD!,97.11,95.82,78917,7/10/2022 23:00
"ALLIED ESPORTS ENTERTAINMENT, INC. (XNAS:AESE)",Software & IT Services,1.18,1.22,65597,7/10/2022 23:51
"AEVA TECHNOLOGIES, INC. (XNYS:AEVA)",Communications & Networking,2.06,2.17,1705352,7/10/2022 23:50
"ADDVANTAGE TECHNOLOGIES GROUP, INC. (XNAS:AEY)",Communications & Networking,2.02,2.05,38571,7/10/2022 20:19
"AUDIOEYE, INC. (XNAS:AEYE)",Software & IT Services,6.14,6.42,15842,7/10/2022 22:19
AETERNA ZENTARIS INC. (XNAS:AEZS),Biotechnology & Medical Research,3.85,3.85,20468,7/10/2022 21:11
Arena Fortify Acquisition Corp (XNAS:AFAC),Holding Companies,10.07,10.08,11561,7/10/2022 20:00
AF ACQUISITION CORP. (XNAS:AFAQ),Holding Companies,9.83,9.83,9820,7/10/2022 20:00
AF ACQUISITION UNT (XNAS:AFAQU),#FIELD!,9.8,9.86,396,3/10/2022 20:00
Aura Fat Projects Acquisition Corp (XNAS:AFAR),Holding Companies,10.06,10.06,54389,7/10/2022 20:00
AllianceBernstein Nat Mu (XNYS:AFB),#FIELD!,10.44,10.46,68759,7/10/2022 23:00
"Affinity Bancshares, Inc. (XNAS:AFBI)",Banking Services,14.56,14.58,3183,7/10/2022 20:00
"AFC Gamma, Inc. (XNAS:AFCG)",Residential & Commercial REIT,15.7,16.31,168323,7/10/2022 23:20
"AMERICAN FINANCIAL GROUP, INC. (XNYS:AFG)",Insurance,127.03,128.74,332693,7/10/2022 23:00
"AMERICAN FINANCIAL GROUP, INC. (XNYS:AFGB)",Insurance,23.24,23.43,7276,7/10/2022 23:00
"AMERICAN FINANCIAL GROUP, INC. (XNYS:AFGC)",Insurance,20.48,20.71,7595,7/10/2022 23:00
"AMERICAN FINANCIAL GROUP, INC. (XNYS:AFGD)",Insurance,22.01,22.51,6397,7/10/2022 23:00
"AMERICAN FINANCIAL GROUP, INC. (XNYS:AFGE)",Insurance,19.33,19.63,3461,7/10/2022 23:00
"ACUTUS MEDICAL, INC. (XNAS:AFIB)",Healthcare Equipment & Supplies,0.73,0.85,102035,7/10/2022 20:08
AFLAC INCORPORATED (XWBO:AFL),Insurance,59.18,60.13,2325930,9/16/2022 15:50
Affimed NV (XNAS:AFMD),Biotechnology & Medical Research,1.9,1.96,1260605,7/10/2022 22:44
Forafric Global PLC (XNAS:AFRI),Food & Tobacco,11.39,11.34,52981,7/10/2022 20:00
Affirm Holdings Inc (XNAS:AFRM),Financial Technology (Fintech) & Infrastructure,18.9,20.95,10560950,7/10/2022 23:59
Apollo Senior Float Rate (XNYS:AFT),#FIELD!,12.45,12.57,52634,7/10/2022 23:00
AfterNext HealthTech Acquisition Corp. (XNYS:AFTR),Holding Companies,9.79,9.79,69673,7/10/2022 23:00
Afya Limited (XNAS:AFYA),Professional & Business Education,14.77,14.95,242466,7/10/2022 22:19
First Majestic Silver Corp. (XNYS:AG),Metals & Mining,8.23,8.99,7824334,7/10/2022 23:58
AFRICAN GOLD ACQUISITION CORPORATION (XNYS:AGAC),Holding Companies,9.91,9.92,112145,7/10/2022 23:00
AGBA Acquisition Limited (XNAS:AGBA),Holding Companies,11.46,11.45,6570,7/10/2022 20:00
Altimeter Growth Corp 2 (XNYS:AGCB),Holding Companies,9.95,9.95,124780,7/10/2022 23:00
AGCO CORPORATION (XNYS:AGCO),"Machinery, Equipment & Components",106.15,106.4,634818,7/10/2022 23:00
abrdn Glbl Dyn Div (XNYS:AGD),#FIELD!,8.77,8.73,45790,7/10/2022 23:00
"AGEX THERAPEUTICS, INC. (XNYS:AGE)",Biotechnology & Medical Research,0.59,0.57,20870,8/10/2022 0:00
AGENUS INC. (XNAS:AGEN),Biotechnology & Medical Research,2.68,2.8,4796501,7/10/2022 23:58
"AGROFRESH SOLUTIONS, INC. (XNAS:AGFS)",Chemicals,1.56,1.49,18153,7/10/2022 20:00
Agrify Corp (XNAS:AGFY),Food & Tobacco,0.44,0.54,1633681,7/10/2022 23:59
Agile Growth Corp (XNAS:AGGR),Holding Companies,9.94,9.92,114459,4/10/2022 20:00
AGILE GROWTH UNT (XNAS:AGGRU),#FIELD!,9.92,9.92,6501,3/10/2022 20:00
ALAMOS GOLD INC. (XNYS:AGI),Metals & Mining,7.82,8.09,3777996,7/10/2022 23:00
"AGILETHOUGHT, INC. (XNAS:AGIL)",Software & IT Services,4.5,4.25,16670,7/10/2022 20:00
"AGIOS PHARMACEUTICALS, INC. (XNAS:AGIO)",Biotechnology & Medical Research,27.09,28.83,942314,7/10/2022 22:20
"AGILON HEALTH, INC. (XNYS:AGL)",Healthcare Providers & Services,22.56,23.14,2415986,7/10/2022 23:00
"AEGLEA BIOTHERAPEUTICS, INC. (XNAS:AGLE)",Biotechnology & Medical Research,0.5,0.53,321554,7/10/2022 23:02
FEDERAL AGRICULTURAL MORTGAGE CORPORATION (XNYS:AGM),Banking Services,101.12,103.23,31080,7/10/2022 23:00
AGM Group Holdings Inc (XNAS:AGMH),Software & IT Services,1.79,1.64,9906,7/10/2022 20:00
AGNC INVESTMENT CORP. (XNAS:AGNC),Residential & Commercial REIT,7.87,8.2,14854579,7/10/2022 23:59
AGNC INVESTMENT CORP. (XNAS:AGNCL),Residential & Commercial REIT,20.84,20.88,24280000,7/10/2022 20:00
AGNC INVESTMENT CORP. (XNAS:AGNCM),Residential & Commercial REIT,18.99,19.39,31949,7/10/2022 20:00
AGNC INVESTMENT CORP. (XNAS:AGNCN),Residential & Commercial REIT,23.35,23.65,77559,7/10/2022 20:00
AGNC INVESTMENT CORP. (XNAS:AGNCO),Residential & Commercial REIT,20.06,20.12,51415,7/10/2022 20:46
AGNC INVESTMENT CORP. (XNAS:AGNCP),Residential & Commercial REIT,18.92,19.18,69558,7/10/2022 20:00
ASSURED GUARANTY LTD. (XNYS:AGO),Insurance,50.25,50.72,381426,7/10/2022 23:00
"Avangrid, Inc. (XNYS:AGR)",Electrical Utilities & IPPs,39.64,41.01,894699,7/10/2022 23:55
AgriFORCE Growing Systems Ltd (XNAS:AGRI),Pharmaceuticals,1.47,1.55,1028771,7/10/2022 22:37
Adecoagro SA (XNYS:AGRO),Food & Tobacco,8.51,8.55,585225,7/10/2022 23:00
"AGILE THERAPEUTICS, INC. (XNAS:AGRX)",Biotechnology & Medical Research,0.27,0.3,1261178,7/10/2022 23:55
"PLAYAGS, INC. (XNYS:AGS)",Hotels & Entertainment Services,5.93,6,276174,7/10/2022 23:00
APPLIED GENETIC TECHNOLOGIES CORPORATION (XNAS:AGTC),Biotechnology & Medical Research,0.27,0.27,645812,7/10/2022 23:59
"AGILITI, INC. (XNYS:AGTI)",Healthcare Equipment & Supplies,15.76,16.24,226904,7/10/2022 23:00
"ARGAN, INC. (XNYS:AGX)",Construction & Engineering,32.03,33.01,101625,7/10/2022 23:56
"AGILYSYS, INC. (XNAS:AGYS)",Software & IT Services,54.22,56.91,124417,7/10/2022 20:02
ADAPTHEALTH CORP. (XNAS:AHCO),Healthcare Equipment & Supplies,19.91,20.01,1375308,7/10/2022 22:23
Akso Health Group (XNAS:AHG),Software & IT Services,0.87,0.89,12116,7/10/2022 20:00
"ARMADA HOFFLER PROPERTIES, INC. (XNYS:AHH)",Residential & Commercial REIT,10.42,10.56,363978,7/10/2022 23:44
ADVANCED HUMAN IMAGING LTD (XNAS:AHI),Software & IT Services,0.53,0.54,2553251,9/30/2022 21:21
ADRAD HOLDINGS LIMITED (XASX:AHL),#FIELD!,1.44,1.5,,7/10/2022 8:00
AVISTA PUBLIC ACQUISITION CORP. II (XNAS:AHPA),Holding Companies,10.27,10.26,107419,7/10/2022 20:00
AVISTA PUBLIC ACQUISITION II UNT (XNAS:AHPAU),#FIELD!,10.44,10.45,1490,7/10/2022 19:59
"ALLIED HEALTHCARE PRODUCTS, INC. (XNAS:AHPI)",Healthcare Equipment & Supplies,1.34,1.38,42411,7/10/2022 20:00
Ahren Acquisition Corp. (XNAS:AHRN),Holding Companies,10.07,10.06,77917,6/10/2022 20:00
"ASHFORD HOSPITALITY TRUST, INC. (XNYS:AHT)",Residential & Commercial REIT,6.85,6.99,502649,7/10/2022 23:10
AIB Acquisition Corporation (XNAS:AIB),Holding Companies,10.06,10.05,3690,6/10/2022 20:00
Arlington Asset Investment Corp. (XNYS:AIC),Investment Banking & Investment Services,23.65,23.92,2393,6/10/2022 23:00
Apollo Tactical Income (XNYS:AIF),#FIELD!,12.02,12.1,41122,7/10/2022 23:00
"AMERICAN INTERNATIONAL GROUP, INC. (XNYS:AIG)",Insurance,49.71,50.76,5191725,7/10/2022 23:00
AESTHETIC MEDICAL INTERNATIONAL HOLDINGS GROUP LIMITED (XNAS:AIH),Healthcare Providers & Services,1.61,1.7,5971,7/10/2022 20:00
SENMIAO TECHNOLOGY LIMITED (XNAS:AIHS),Specialty Retailers,0.85,0.92,94990,7/10/2022 20:00
AIKIDO PHARMA INC. (XNAS:AIKI),Biotechnology & Medical Research,6.92,6.84,153562,7/10/2022 20:00
AIM ImmunoTech Inc. (XNYS:AIM),Biotechnology & Medical Research,0.54,0.57,83476,8/10/2022 0:00
AIMFINITY INVESTMENT I UNT (XNAS:AIMAU),#FIELD!,9.9,9.99,146,9/29/2022 14:14
ALTRA INDUSTRIAL MOTION CORP. (XNAS:AIMC),"Machinery, Equipment & Components",34.96,36.23,216071,7/10/2022 22:25
"Ainos, Inc. (XNAS:AIMD)",Biotechnology & Medical Research,1.6,1.77,1487444,7/10/2022 23:39
ALBANY INTERNATIONAL CORP. (XNYS:AIN),"Machinery, Equipment & Components",83.35,83.48,118285,7/10/2022 23:00
ASHFORD INC. (XNYS:AINC),Investment Banking & Investment Services,15.81,16.52,13873,7/10/2022 20:10
Vrts Art Intell & Tech O (XNYS:AIO),#FIELD!,15.89,16.3,124740,7/10/2022 23:00
"ARTERIS, INC. (XNAS:AIP)",Software & IT Services,6.09,6.53,148901,7/10/2022 22:24
AAR CORP. (XNYS:AIR),Aerospace & Defense,38.28,38.12,328365,7/10/2022 23:00
Apartment Income REIT Corp. (XNYS:AIRC),Residential & Commercial REIT,36.01,37.12,943196,7/10/2022 23:00
"AIRGAIN, INC. (XNAS:AIRG)",Communications & Networking,7.1,7.13,28349,7/10/2022 22:24
AIR INDUSTRIES GROUP (XNYS:AIRI),Aerospace & Defense,0.56,0.56,59315,8/10/2022 0:00
Airsculpt Technologies Inc (XNAS:AIRS),Healthcare Providers & Services,6.62,6.99,100618,7/10/2022 22:24
"AIR T, INC. (XNAS:AIRT)",Freight & Logistics Services,19,20.29,15565,7/10/2022 20:00
Air T Funding (XNAS:AIRTP),#FIELD!,21.05,22.5,894,7/10/2022 20:00
"APPLIED INDUSTRIAL TECHNOLOGIES, INC. (XNYS:AIT)","Machinery, Equipment & Components",107.9,110.26,179254,7/10/2022 23:00
Meta Data Limited (XNYS:AIU),Miscellaneous Educational Service Providers,1.08,1.1,56932,7/10/2022 23:30
APARTMENT INVESTMENT AND MANAGEMENT COMPANY (XNYS:AIV),Residential & Commercial REIT,7.1,7.36,1622479,7/10/2022 23:00
"ASSURANT, INC. (XNYS:AIZ)",Insurance,147.69,149.93,383573,7/10/2022 23:00
"ASSURANT, INC. (XNYS:AIZN)",Insurance,20.84,21.23,12894,7/10/2022 23:00
ARTHUR J. GALLAGHER & CO. (XNYS:AJG),Insurance,174.31,179.1,1056818,7/10/2022 23:00
"AEROJET ROCKETDYNE HOLDINGS, INC. (XNYS:AJRD)",Aerospace & Defense,41.01,41.06,530565,7/10/2022 23:35
GREAT AJAX CORP. (XNYS:AJX),Residential & Commercial REIT,7.62,7.86,77977,7/10/2022 23:00
GREAT AJAX CORP. (XNYS:AJXA),Residential & Commercial REIT,24.2,24.35,5271,7/10/2022 23:00
A.K.A. BRANDS HOLDING CORP. (XNYS:AKA),Specialty Retailers,1.37,1.47,275915,7/10/2022 23:00
"AKAMAI TECHNOLOGIES, INC. (XNAS:AKAM)",Software & IT Services,82.08,84.44,1736661,7/10/2022 22:02
"AKEBIA THERAPEUTICS, INC. (XNAS:AKBA)",Biotechnology & Medical Research,0.3,0.33,1610265,7/10/2022 23:07
Sports Ventures Acquisition Corp (XNAS:AKIC),Holding Companies,9.98,9.96,109593,6/10/2022 20:00
SPORTS VENTURES ACQ UNT (XNAS:AKICU),#FIELD!,9.97,9.96,911,7/10/2022 18:36
"AKILI, INC. (XNAS:AKLI)",Healthcare Equipment & Supplies,2.27,2.51,251550,7/10/2022 22:16
AKORA RESOURCES LIMITED (XASX:AKO),Metals & Mining,0.2,0.2,55930,7/10/2022 8:00
ACADIA REALTY TRUST (XNYS:AKR),Residential & Commercial REIT,12.47,12.79,658848,7/10/2022 23:00
"Akero Therapeutics, Inc. (XNAS:AKRO)",Biotechnology & Medical Research,38.13,39.26,3111240,7/10/2022 23:53
"AKOUSTIS TECHNOLOGIES, INC. (XNAS:AKTS)",Electronic Equipment & Parts,2.83,2.96,423256,7/10/2022 22:29
"AKARI THERAPEUTICS, PLC (XNAS:AKTX)",Biotechnology & Medical Research,0.57,0.62,121573,7/10/2022 23:10
Akumin Inc. (XNAS:AKU),Healthcare Providers & Services,1.82,1.92,233853,7/10/2022 20:00
"AKOUOS, INC. (XNAS:AKUS)",Biotechnology & Medical Research,6.83,7.18,128290,7/10/2022 23:43
"AKOYA BIOSCIENCES, INC. (XNAS:AKYA)",Healthcare Equipment & Supplies,11.81,12.68,212929,7/10/2022 21:26
AIR LEASE CORPORATION (XNYS:AL),Professional & Commercial Services,32.36,32.87,554534,7/10/2022 23:00
ALBEMARLE CORPORATION (XNYS:ALB),Chemicals,272.53,280.94,1363422,7/10/2022 23:50
