Symbol,Industry,Price,Previous Close,Volume average,Last trade time
Equinor ASA (XNYS:EQNR),Oil & Gas,35.24,35.31,4453613,7/10/2022 23:00
EQONEX Ltd (XNAS:EQOS),Financial Technology (Fintech) & Infrastructure,0.41,0.4,124830,7/10/2022 22:36
EQUITY RESIDENTIAL (XNYS:EQR),Residential & Commercial REIT,62.53,64.45,1645794,7/10/2022 23:50
"EQRx, Inc. (XNAS:EQRX)",Biotechnology & Medical Research,4.84,5.12,3964241,7/10/2022 20:02
Equus Total Return (XNYS:EQS),#FIELD!,1.65,1.83,27944,7/10/2022 23:00
EQT CORPORATION (XNYS:EQT),Oil & Gas,43.17,43.94,11849719,7/10/2022 23:59
Equinox Gold Corp. (XNYS:EQX),Metals & Mining,3.52,3.82,2409764,7/10/2022 23:32
"ERASCA, INC. (XNAS:ERAS)",Biotechnology & Medical Research,7.89,8.45,809299,7/10/2022 20:02
Allspring Multi-Sector (XNYS:ERC),#FIELD!,8.87,8.9,68482,7/10/2022 20:10
EAST RESOURCES ACQUISITION COMPANY (XNAS:ERES),Holding Companies,10.06,10.06,10470,7/10/2022 20:00
EAST RESOURCES ACQUISITION COMPA UNT (XNAS:ERESU),#FIELD!,10.09,10.07,856,6/10/2022 20:00
ENERPLUS CORPORATION (XNYS:ERF),Oil & Gas,16.16,16.15,1757837,7/10/2022 23:20
Allspring Ut & Hi Inc (XNYS:ERH),#FIELD!,10.86,11.15,20311,7/10/2022 20:10
Telefonaktiebolaget LM Ericsson (XNAS:ERIC),Communications & Networking,6.1,6.22,8354721,7/10/2022 23:37
ERIE INDEMNITY COMPANY (XNAS:ERIE),Insurance,229.71,232.77,65953,7/10/2022 20:18
"ENERGY RECOVERY, INC. (XNAS:ERII)","Machinery, Equipment & Components",21.5,22.13,524101,7/10/2022 21:36
Embraer SA (XNYS:ERJ),Aerospace & Defense,9.45,9.84,1483861,7/10/2022 23:00
Ero Copper Corp. (XNYS:ERO),Metals & Mining,12.14,11.7,72186,7/10/2022 23:44
Erytech Pharma SA (XNAS:ERYP),Biotechnology & Medical Research,0.7,0.7,8902,7/10/2022 20:00
Eversource Energy (XNYS:ES),Electrical Utilities & IPPs,74.25,75.49,1637202,7/10/2022 23:02
ESAB CORPORATION (XNYS:ESAB),"Machinery, Equipment & Components",34.3,35.2,409792,7/10/2022 23:00
ESGEN Acquisition Corporation (XNAS:ESAC),Holding Companies,10.15,10.15,50206,7/10/2022 20:00
"ESCALADE, INCORPORATED (XNAS:ESCA)",Leisure Products,10.76,10.99,16401,7/10/2022 20:00
ESCO TECHNOLOGIES INC. (XNYS:ESE),"Machinery, Equipment & Components",75.73,78.11,73279,7/10/2022 23:00
EUROSEAS LTD (XNAS:ESEA),Freight & Logistics Services,20.72,20.96,52652,7/10/2022 22:57
ENSTAR GROUP LIMITED (XNAS:ESGR),Insurance,183.34,181.7,51430,7/10/2022 20:01
ENSTAR GROUP LIMITED (XNAS:ESGRO),Insurance,23.85,24.29,12181,7/10/2022 22:20
ENSTAR GROUP LIMITED (XNAS:ESGRP),Insurance,22.94,23.31,20158,7/10/2022 20:00
ELEMENT SOLUTIONS INC (XNYS:ESI),Chemicals,16.31,17.12,1293547,7/10/2022 23:00
ELBIT SYSTEMS LTD (XNAS:ESLT),Aerospace & Defense,197.61,198.61,21403,7/10/2022 20:03
ESM ACQUISITION CORPORATION (XNYS:ESM),Holding Companies,9.94,9.91,60260,6/10/2022 23:00
"ENGAGESMART, INC. (XNYS:ESMT)",Software & IT Services,21.69,21.83,590583,7/10/2022 23:00
ESSENT GROUP LTD (XNYS:ESNT),Insurance,36.01,37.32,562031,7/10/2022 23:00
ENERGY SERVICES OF AMERICA CORPORATION (XNAS:ESOA),Construction & Engineering,2.73,2.74,33889,7/10/2022 22:45
ESPEY MFG. & ELECTRONICS CORP. (XNYS:ESP),"Machinery, Equipment & Components",13.1,13.27,3260,8/10/2022 0:00
"ESPERION THERAPEUTICS, INC. (XNAS:ESPR)",Pharmaceuticals,7.42,7.04,1006641,7/10/2022 21:51
"ESQUIRE FINANCIAL HOLDINGS, INC. (XNAS:ESQ)",Banking Services,37.19,37.43,22088,7/10/2022 20:01
"EMPIRE STATE REALTY TRUST, INC. (XNYS:ESRT)",Residential & Commercial REIT,6.4,6.59,1097849,7/10/2022 23:00
"ESSEX PROPERTY TRUST, INC. (XNYS:ESS)",Residential & Commercial REIT,221.21,228.69,433741,7/10/2022 23:00
"ESSA Bancorp, Inc. (XNAS:ESSA)",Banking Services,18.38,18.8,23921,7/10/2022 20:00
East Stone Acquisition Corporation (XNAS:ESSC),Holding Companies,10.37,10.39,25498,7/10/2022 20:00
EAST STONE ACQUISITION UNT (XNAS:ESSCU),#FIELD!,10.7,10.37,322,4/10/2022 20:00
"Establishment Labs Holdings, Inc. (XNAS:ESTA)",Healthcare Equipment & Supplies,55.33,57.31,128356,7/10/2022 20:01
Elastic NV (XNYS:ESTC),Software & IT Services,71.95,76.11,1416206,7/10/2022 23:00
"EARTHSTONE ENERGY, INC. (XNYS:ESTE)",Oil & Gas,14.81,15.26,2223514,7/10/2022 23:00
ENERGY TRANSFER UNT (XNYS:ET),#FIELD!,11.54,11.55,21927184,7/10/2022 23:56
Eaton Vance T-M B-W Inc (XNYS:ETB),#FIELD!,13.71,14.24,62428,7/10/2022 23:00
ETHAN ALLEN INTERIORS INC. (XNYS:ETD),Household Goods,22.19,22.57,233888,7/10/2022 23:00
Eaton Vance Tx-Ad Gl Div (XNYS:ETG),#FIELD!,14.8,15.1,194859,7/10/2022 23:00
EnviroMetal Technologies Inc. (XCNQ:ETI),Metals & Mining,0.09,0.09,56660,7/10/2022 13:31
Eaton Vance R-Mgd Eq Inc (XNYS:ETJ),#FIELD!,8.25,8.43,140479,7/10/2022 23:00
EATON CORPORATION PUBLIC LIMITED COMPANY (XNYS:ETN),"Machinery, Equipment & Components",136.83,142.45,1877162,7/10/2022 23:00
"89BIO, INC. (XNAS:ETNB)",Biotechnology & Medical Research,8.24,7.52,2165506,7/10/2022 23:58
Eaton Vance Tx-Ad Gl Opp (XNYS:ETO),#FIELD!,20.55,20.86,55370,7/10/2022 23:00
"ETON PHARMACEUTICALS, INC. (XNAS:ETON)",Pharmaceuticals,2.25,2.25,42712,7/10/2022 20:00
ENTERGY CORPORATION (XNYS:ETR),Electrical Utilities & IPPs,101.23,102.71,1206740,7/10/2022 23:00
Equitrans Midstream Corporation (XNYS:ETRN),Oil & Gas Related Equipment and Services,7.92,8.1,5624409,7/10/2022 23:00
"ETSY, INC. (XNAS:ETSY)",Diversified Retail,110.44,115.11,2706132,7/10/2022 23:56
Eaton Vance T-M B-W Opps (XNYS:ETV),#FIELD!,13.02,13.54,323711,7/10/2022 23:00
Eaton Vance Tx-Mg Gl B-W (XNYS:ETW),#FIELD!,7.82,7.95,248794,7/10/2022 23:00
"E2OPEN PARENT HOLDINGS, INC. (XNYS:ETWO)",Software & IT Services,6.49,6.9,1919637,7/10/2022 23:00
Eaton Vance Mun Inc 2028 (XNYS:ETX),#FIELD!,18.99,18.8,13079,7/10/2022 23:00
Eaton Vance T-M D-E Inc (XNYS:ETY),#FIELD!,10.94,11.35,257996,7/10/2022 23:00
Eucrates Biomedical Acquisition Corp. (XNAS:EUCR),Holding Companies,10.05,10.02,20649,7/10/2022 20:00
EUCRATES BIOMED ACQ UNT (XNAS:EUCRU),#FIELD!,10.02,10.02,7957,5/10/2022 16:29
Euronav NV (XNYS:EURN),Oil & Gas Related Equipment and Services,15.28,15.06,1343855,7/10/2022 23:59
ENVIVA INC. (XNYS:EVA),Paper & Forest Products,61.76,63.13,369840,7/10/2022 23:00
Evaxion Biotech A/S (XNAS:EVAX),Biotechnology & Medical Research,2.85,2.89,1996993,7/10/2022 20:00
"EVERBRIDGE, INC. (XNAS:EVBG)",Software & IT Services,31.64,33.79,666909,7/10/2022 20:07
"EVANS BANCORP, INC. (XNYS:EVBN)",Banking Services,36.28,36.67,14595,8/10/2022 0:00
ENTRAVISION COMMUNICATIONS CORPORATION (XNYS:EVC),Media & Publishing,4.09,4.18,214049,7/10/2022 23:00
EVERCOMMERCE INC. (XNAS:EVCM),Software & IT Services,9.72,10.75,172448,7/10/2022 20:47
"EVERQUOTE, INC. (XNAS:EVER)",Software & IT Services,6.6,6.79,164596,7/10/2022 20:01
"Eve Holding, Inc. (XNYS:EVEX)",Aerospace & Defense,7.64,8.03,138368,7/10/2022 23:00
Eaton Vance Senior Inc (XNYS:EVF),#FIELD!,5.25,5.34,47870,7/10/2022 23:00
Eaton Vance Sht Dur DI (XNYS:EVG),#FIELD!,10.1,10.17,48393,7/10/2022 23:00
EVOGENE LTD (XNAS:EVGN),Biotechnology & Medical Research,0.74,0.75,76384,7/10/2022 20:44
EVGO INC. (XNAS:EVGO),Electrical Utilities & IPPs,7.94,8.17,2231128,7/10/2022 23:52
EVERGREEN CORPORATION (XNAS:EVGR),Holding Companies,10.1,10.09,23451,7/10/2022 20:00
EVERGREEN UNT (XNAS:EVGRU),#FIELD!,10.1,10.1,5,9/23/2022 20:00
"EVOLENT HEALTH, INC. (XNYS:EVH)",Healthcare Equipment & Supplies,34.09,36.67,972077,7/10/2022 23:00
"EVI INDUSTRIES, INC. (XNYS:EVI)","Machinery, Equipment & Components",15.4,16.39,16983,7/10/2022 22:01
"EVER-GLORY INTERNATIONAL GROUP, INC. (XNAS:EVK)",Textiles & Apparel,0.9,0.9,12162,7/10/2022 20:25
"EVELO BIOSCIENCES, INC. (XNAS:EVLO)",Biotechnology & Medical Research,2.25,2.35,213620,7/10/2022 20:01
"EVOLV TECHNOLOGIES HOLDINGS, INC. (XNAS:EVLV)",Communications & Networking,2.17,2.31,416825,7/10/2022 22:00
Eaton Vance CA Muni Bd (XNYS:EVM),#FIELD!,8.39,8.41,85624,7/10/2022 20:10
Eaton Vance Muni Inc Tr (XNYS:EVN),#FIELD!,9.94,9.94,102386,7/10/2022 23:00
Evotec SE (XNAS:EVO),Biotechnology & Medical Research,8.69,9.01,34681,7/10/2022 21:58
EVO ACQUISITION CORP. (XNAS:EVOJ),Holding Companies,9.87,9.87,5704,6/10/2022 20:00
EVO ACQUISITION UNT (XNAS:EVOJU),#FIELD!,9.87,9.88,884,6/10/2022 20:00
"EVOKE PHARMA, INC. (XNAS:EVOK)",Pharmaceuticals,1.94,2.1,15005,7/10/2022 20:00
"EVO PAYMENTS, INC. (XNAS:EVOP)",Professional & Commercial Services,33.56,33.47,928445,7/10/2022 20:01
EVERCORE INC. (XNYS:EVR),Investment Banking & Investment Services,86.28,90,526876,7/10/2022 23:00
"Evergy, Inc. (XNYS:EVRG)",Electrical Utilities & IPPs,57.04,58.03,1187061,7/10/2022 23:00
EVERI HOLDINGS INC. (XNYS:EVRI),Hotels & Entertainment Services,17.54,17.89,549977,7/10/2022 23:49
Eaton Vance Tax Div Inc (XNYS:EVT),#FIELD!,22.08,22.6,111154,7/10/2022 23:00
Evertec Inc (XNYS:EVTC),Professional & Commercial Services,32.22,32.53,435467,7/10/2022 23:00
VERTICAL AEROSPACE LTD. (XNYS:EVTL),Aerospace & Defense,10.32,10.89,706461,7/10/2022 23:29
"ENVIROTECH VEHICLES, INC. (XNAS:EVTV)",Automobiles & Auto Parts,4.1,4.13,66581,7/10/2022 20:00
Eaton Vance Ltd Dur Inc (XNYS:EVV),#FIELD!,9.47,9.46,253119,8/10/2022 0:00
EDWARDS LIFESCIENCES CORPORATION (XNYS:EW),Healthcare Equipment & Supplies,84.23,86.48,2804769,7/10/2022 23:00
"EAST WEST BANCORP, INC. (XNAS:EWBC)",Banking Services,71.06,73.05,746645,7/10/2022 20:18
"EUROPEAN WAX CENTER, INC. (XNAS:EWCZ)",Personal & Household Products & Services,17.11,17.26,433467,7/10/2022 20:01
Edgewise Therapeutics Inc (XNAS:EWTX),Biotechnology & Medical Research,9.96,11.08,466486,7/10/2022 20:51
EXSCIENTIA PLC (XNAS:EXAI),Biotechnology & Medical Research,8.6,8.81,142468,7/10/2022 20:00
EXACT SCIENCES CORPORATION (XNAS:EXAS),Biotechnology & Medical Research,33.82,36.32,2099911,7/10/2022 23:55
EXELON CORPORATION (XNAS:EXC),Electrical Utilities & IPPs,36.96,37.76,8253224,7/10/2022 23:45
Eaton Vance Tx-Mg B-WS (XNYS:EXD),#FIELD!,9.7,9.49,26083,7/10/2022 23:00
"EXELIXIS, INC. (XNAS:EXEL)",Biotechnology & Medical Research,15.4,15.6,2281800,7/10/2022 22:28
"EXPENSIFY, INC. (XNAS:EXFY)",Software & IT Services,14.84,15.52,530257,7/10/2022 20:27
Eaton Vance TxMgdGlDvEIn (XNYS:EXG),#FIELD!,7.36,7.55,648248,7/10/2022 23:00
Endeavour Silver Corp. (XNYS:EXK),Metals & Mining,3.34,3.66,2492728,7/10/2022 23:58
"EXLSERVICE HOLDINGS, INC. (XNAS:EXLS)",Professional & Commercial Services,157.02,160.73,661457,7/10/2022 21:08
Excellon Resources Inc (XNYS:EXN),Metals & Mining,0.36,0.37,57605,8/10/2022 0:00
EAGLE MATERIALS INC. (XNYS:EXP),Construction Materials,110.66,114.05,360406,7/10/2022 23:00
"EXPEDITORS INTERNATIONAL OF WASHINGTON, INC (XNAS:EXPD)",Freight & Logistics Services,89.2,90.65,1555378,7/10/2022 23:58
"EXPEDIA GROUP, INC. (XNAS:EXPE)",Hotels & Entertainment Services,93.92,95.61,2585920,7/10/2022 23:42
"EXP WORLD HOLDINGS, INC. (XNAS:EXPI)",Real Estate Operations,12.34,12.87,1109412,7/10/2022 23:59
"EXPONENT, INC. (XNAS:EXPO)",Professional & Commercial Services,88.36,87.5,204601,7/10/2022 20:18
"EXPRESS, INC. (XNYS:EXPR)",Specialty Retailers,1.14,1.19,1706174,7/10/2022 23:01
EXTRA SPACE STORAGE INC. (XNYS:EXR),Residential & Commercial REIT,165.17,172.11,885491,7/10/2022 23:00
EXTERRAN CORPORATION (XNYS:EXTN),Oil & Gas Related Equipment and Services,5.04,5,126046,7/10/2022 23:00
"EXTREME NETWORKS, INC. (XNAS:EXTR)",Communications & Networking,13.7,14.28,988659,7/10/2022 20:03
"NATIONAL VISION HOLDINGS, INC. (XNAS:EYE)",Specialty Retailers,33.62,34.37,765550,7/10/2022 20:32
"EYENOVIA, INC. (XNAS:EYEN)",Pharmaceuticals,2.74,2.68,379461,7/10/2022 23:59
"EYEPOINT PHARMACEUTICALS, INC. (XNAS:EYPT)",Pharmaceuticals,6.16,6.29,147159,7/10/2022 23:09
"EZFILL HOLDINGS, INC. (XNAS:EZFL)",Oil & Gas,0.61,0.6,125762,7/10/2022 23:22
EZGO Technologies Ltd. (XNAS:EZGO),Leisure Products,0.44,0.44,16755,7/10/2022 22:45
"EZCORP, INC. (XNAS:EZPW)",Banking Services,7.89,7.94,301773,7/10/2022 20:01
FORD MOTOR COMPANY (XNYS:F),Automobiles & Auto Parts,12.2,12.36,77077281,7/10/2022 23:59
FIRST ADVANTAGE CORPORATION (XNAS:FA),Professional & Commercial Services,13.2,13.6,405123,7/10/2022 20:10
FIGURE ACQUISITION CORP. I (XNYS:FACA),Holding Companies,9.86,9.87,169821,7/10/2022 23:00
Freedom Acquisition I Corp (XNYS:FACT),Holding Companies,9.95,9.91,99371,7/10/2022 23:00
FIRST AMERICAN FINANCIAL CORPORATION (XNYS:FAF),Insurance,47.72,49,745888,7/10/2022 23:00
First Tr/abrdn Gl Op Inc (XNYS:FAM),#FIELD!,5.45,5.53,30910,7/10/2022 23:00
"FARMMI, INC. (XNAS:FAMI)",Food & Tobacco,0.55,0.58,294892,7/10/2022 23:30
"DIAMONDBACK ENERGY, INC. (XNAS:FANG)",Oil & Gas,142.43,142.33,2409481,7/10/2022 23:55
Fanhua Inc. (XNAS:FANH),Insurance,5.35,5.65,34720,7/10/2022 21:05
FARMER BROS. CO. (XNAS:FARM),Food & Tobacco,4.77,4.92,86575,7/10/2022 23:29
"FARO TECHNOLOGIES, INC. (XNAS:FARO)",Electronic Equipment & Parts,27.27,29.22,107121,7/10/2022 20:01
Fastenal Company (XNAS:FAST),"Machinery, Equipment & Components",45.85,47.38,3608548,7/10/2022 22:45
FAT BRANDS INC. (XNAS:FAT),Hotels & Entertainment Services,7.5,7.8,6401,7/10/2022 20:00
FAT BRANDS INC. (XNAS:FATBB),Hotels & Entertainment Services,7.55,8.21,1156,7/10/2022 23:06
FAT BRANDS INC. (XNAS:FATBP),Hotels & Entertainment Services,18,17.56,6267,7/10/2022 20:10
"FATE THERAPEUTICS, INC. (XNAS:FATE)",Biotechnology & Medical Research,21.47,23.22,1334682,7/10/2022 23:12
FATHOM DIGITAL MANUFACTURING CORPORATION (XNYS:FATH),"Machinery, Equipment & Components",1.97,1.93,86499,7/10/2022 23:00
FAT PROJECTS ACQUISITION CORP (XNAS:FATP),Holding Companies,9.98,9.96,26612,7/10/2022 20:00
"ABRDN ASIA-PACIFIC INCOME FUND, INC. (XNYS:FAX)",Collective Investments,2.51,2.55,1261237,8/10/2022 0:00
FAZE HOLDINGS INC. (XNAS:FAZE),Software & IT Services,5.64,5.44,1058510,7/10/2022 23:59
"FLAGSTAR BANCORP, INC. (XNYS:FBC)",Banking Services,32.37,33.68,519768,7/10/2022 23:00
"FORTUNE BRANDS HOME & SECURITY, INC. (XNYS:FBHS)",Homebuilding & Construction Supplies,56.76,58.89,1339279,7/10/2022 23:00
"FORTRESS BIOTECH, INC. (XNAS:FBIO)",Pharmaceuticals,0.88,0.9,173578,7/10/2022 22:50
"FORTRESS BIOTECH, INC. (XNAS:FBIOP)",Pharmaceuticals,20.2,20.35,11649,7/10/2022 20:00
"FIRST BUSINESS FINANCIAL SERVICES, INC. (XNAS:FBIZ)",Banking Services,33.07,33.41,20463,7/10/2022 20:01
FB Financial Corporation (XNYS:FBK),Banking Services,38.71,39.26,145494,7/10/2022 23:00
"THE FIRST BANCSHARES, INC. (XNAS:FBMS)",Banking Services,30.36,30.18,122361,7/10/2022 20:01
FIRST BANCORP (XNAS:FBNC),Banking Services,37.6,38.21,165319,7/10/2022 20:01
"THE FIRST BANCORP, INC. (XNAS:FNLC)",Banking Services,27.72,28.13,13941,7/10/2022 20:04
"FRANKLIN BSP REALTY TRUST, INC. (XNYS:FBRT)",Residential & Commercial REIT,11.11,11.09,502161,7/10/2022 23:00
"FORTE BIOSCIENCES, INC. (XNAS:FBRX)",Biotechnology & Medical Research,1.09,1.11,95008,7/10/2022 20:54
FRANKLIN COVEY CO. (XNYS:FC),Professional & Business Education,45.83,47.15,80854,7/10/2022 23:00
"FIRST CAPITAL, INC. (XNAS:FCAP)",Banking Services,24.78,26.33,2730,7/10/2022 20:00
Fortress Capital Acquisition Corp (XNYS:FCAX),Holding Companies,9.97,9.97,196533,7/10/2022 23:00
"First Community Bankshares, Inc. (XNAS:FCBC)",Banking Services,32.62,33.18,30223,7/10/2022 20:01
FIRST COMMUNITY CORPORATION (XNAS:FCCO),Banking Services,17.16,17.19,10300,7/10/2022 20:00
"FUELCELL ENERGY, INC. (XNAS:FCEL)",Renewable Energy,3.11,3.27,10708438,7/10/2022 23:59
FIRST COMMONWEALTH FINANCIAL CORPORATION (XNYS:FCF),Banking Services,13.1,13.4,491909,7/10/2022 23:00
"FIRSTCASH HOLDINGS, INC. (XNAS:FCFS)",Banking Services,77.79,78.76,262103,7/10/2022 20:10
"FTI CONSULTING, INC. (XNYS:FCN)",Professional & Commercial Services,172.69,171.66,267516,7/10/2022 23:00
"FIRST CITIZENS BANCSHARES, INC. (XNAS:FCNCA)",Banking Services,825.66,843.46,138740,7/10/2022 20:41
FIRST-CITIZENS BANK & TRUST COMPANY (XNAS:FCNCO),Banking Services,21.31,21.62,19144,7/10/2022 20:00
"FIRST CITIZENS BANCSHARES, INC. (XNAS:FCNCP)",Banking Services,21.1,21.39,18769,7/10/2022 20:00
abrdn Global Income (XNYS:FCO),#FIELD!,4.55,4.63,59248,7/10/2022 20:10
"FOUR CORNERS PROPERTY TRUST, INC. (XNYS:FCPT)",Residential & Commercial REIT,23.07,23.51,397153,7/10/2022 23:00
"First Eagle Alternative Capital BDC, Inc (XNAS:FCRD)",Investment Banking & Investment Services,3.96,4.13,154869,7/10/2022 20:03
"First Eagle Alternative Capital BDC, Inc (XNYS:FCRX)",Investment Banking & Investment Services,23.42,23.34,2580,7/10/2022 23:00
First Tr Sr Fltg RI II (XNYS:FCT),#FIELD!,9.91,9.99,116706,7/10/2022 23:00
FOCUS UNIVERSAL INC. (XNAS:FCUV),Software & IT Services,9.19,9.5,64503,7/10/2022 20:01
FREEPORT-MCMORAN INC. (XNYS:FCX),Metals & Mining,28.95,29.82,17324219,7/10/2022 23:59
"FIDELITY D & D BANCORP, INC. (XNAS:FDBC)",Banking Services,41.32,41.7,8763,7/10/2022 20:01
First Trust Dyn Eur Eq I (XNYS:FDEU),#FIELD!,9.65,9.87,54809,7/10/2022 23:00
"4D MOLECULAR THERAPEUTICS, INC. (XNAS:FDMT)",Biotechnology & Medical Research,7.12,7.62,384454,7/10/2022 20:51
FRESH DEL MONTE PRODUCE INC. (XNYS:FDP),Food & Tobacco,23.67,23.79,248991,7/10/2022 23:00
FIDUS INVESTMENT CORPORATION (XNAS:FDUS),Collective Investments,17.41,17.67,95061,7/10/2022 20:00
FEDEX CORPORATION (XNYS:FDX),Freight & Logistics Services,154.41,155.19,5650760,7/10/2022 23:59
FIRSTENERGY CORP. (XNYS:FE),Electrical Utilities & IPPs,36.1,36.85,4354480,7/10/2022 23:00
"5E Advanced Materials, Inc. (XNAS:FEAM)",Metals & Mining,10.16,11.7,306458,7/10/2022 20:00
Four Seasons Education (Cayman) Inc. (XNYS:FEDU),"School, College & University",11.31,11.86,2532,7/10/2022 23:00
First Trust MLP Ener&Inc (XNYS:FEI),#FIELD!,7.39,7.51,120306,7/10/2022 23:00
"FREQUENCY ELECTRONICS, INC. (XNAS:FEIM)","Machinery, Equipment & Components",5.24,5.43,10726,7/10/2022 20:00
"FRANKLIN ELECTRIC CO., INC. (XNAS:FELE)","Machinery, Equipment & Components",83.83,85.73,164670,7/10/2022 20:01
FEMASYS INC. (XNAS:FEMY),Healthcare Equipment & Supplies,1.33,1.18,13103,7/10/2022 23:51
First Tr Energy Inc & Gr (XNYS:FEN),#FIELD!,15.04,15.13,87475,7/10/2022 20:10
FENNEC PHARMACEUTICALS INC. (XNAS:FENC),Biotechnology & Medical Research,7.78,7.93,250039,7/10/2022 20:00
Phoenix New Media Limited (XNYS:FENG),Media & Publishing,4.77,4.69,11000,7/10/2022 23:00
First Tr/abrdn Emerg Op (XNYS:FEO),#FIELD!,8.95,9.1,37591,7/10/2022 23:00
FERGUSON PLC (XNYS:FERG),Homebuilding & Construction Supplies,109.26,112.84,733337,7/10/2022 23:00
"FORUM ENERGY TECHNOLOGIES, INC. (XNYS:FET)",Oil & Gas Related Equipment and Services,23.74,22.46,34480,7/10/2022 23:00
Fintech Ecosystem Development Corp (XNAS:FEXD),Holding Companies,10.09,10.07,6337,5/10/2022 20:00
FUTUREFUEL CORP. (XNYS:FF),Renewable Energy,5.87,6.03,202117,7/10/2022 23:00
First Tr Enh Equity Inc (XNYS:FFA),#FIELD!,14.76,15.05,50333,7/10/2022 23:00
FIRST FINANCIAL BANCORP. (XNAS:FFBC),Banking Services,21.8,22.27,308728,7/10/2022 20:02
"FFBW, INC. (XNAS:FFBW)",Banking Services,12,12.08,9229,7/10/2022 20:00
Flrty&Crumrine Pf&In Sec (XNYS:FFC),#FIELD!,14.97,15.41,198764,7/10/2022 23:00
"Fuwei Films (Holdings) Co., Ltd. (XNAS:FFHL)",Chemicals,7.94,7.4,17744,7/10/2022 20:00
FLUSHING FINANCIAL CORPORATION (XNAS:FFIC),Banking Services,19.56,19.8,128665,7/10/2022 20:01
FARADAY FUTURE INTELLIGENT ELECTRIC INC. (XNAS:FFIE),Automobiles & Auto Parts,0.64,0.71,34865762,7/10/2022 23:59
"FIRST FINANCIAL BANKSHARES, INC. (XNAS:FFIN)",Banking Services,43.02,43.82,389005,7/10/2022 20:08
"F5, INC. (XNAS:FFIV)",Software & IT Services,144.17,152.24,485672,7/10/2022 21:06
"FIRST FINANCIAL NORTHWEST, INC. (XNAS:FFNW)",Banking Services,15,15.11,6483,7/10/2022 20:00
FIRST FOUNDATION INC. (XNAS:FFWM),Banking Services,17.87,18.7,212805,7/10/2022 20:10
First Tr Spec Fin&Finl (XNYS:FGB),#FIELD!,2.95,2.94,52817,7/10/2022 23:00
"FIRST GUARANTY BANCSHARES, INC. (XNAS:FGBI)",Banking Services,22.09,22.25,13770,7/10/2022 20:01
"FIRST GUARANTY BANCSHARES, INC. (XNAS:FGBIP)",Banking Services,24.01,24.01,1611,7/10/2022 20:00
"FIBROGEN, INC. (XNAS:FGEN)",Biotechnology & Medical Research,14.72,14.26,648379,7/10/2022 23:30
"FG FINANCIAL GROUP, INC. (XNAS:FGF)",Insurance,1.62,1.6,21876,7/10/2022 20:00
"FG FINANCIAL GROUP, INC. (XNAS:FGFPP)",Insurance,17.92,19.72,3661,7/10/2022 20:00
FGI Industries Ltd. (XNAS:FGI),Specialty Retailers,2.19,2.3,22624,7/10/2022 20:00
FG MERGER CORP. (XNAS:FGMC),Holding Companies,10,10.01,4270,5/10/2022 20:00
FG MERGER UNT (XNAS:FGMCU),#FIELD!,10.01,10.01,1513,7/10/2022 20:00
"FIRST HAWAIIAN, INC. (XNAS:FHB)",Banking Services,24.98,25.59,636201,7/10/2022 20:18
"FEDERATED HERMES, INC. (XNYS:FHI)",Investment Banking & Investment Services,32.1,33.02,799839,7/10/2022 23:00
Future Health ESG Corp. (XNAS:FHLT),Holding Companies,10.03,10.03,48289,7/10/2022 20:00
FUTURE HEALTH ESG UNT (XNAS:FHLTU),#FIELD!,10.07,10.14,225,5/10/2022 13:59
FIRST HORIZON CORPORATION (XNYS:FHN),Banking Services,23.02,23.04,4055990,7/10/2022 23:56
"First High-School Education Group Co., Ltd. (XNYS:FHS)","School, College & University",0.59,0.59,160206,7/10/2022 23:00
FOGHORN THERAPEUTICS INC. (XNAS:FHTX),Biotechnology & Medical Research,8.14,8.43,78145,7/10/2022 20:01
Focus Impact Acquisition Corp (XNAS:FIAC),Holding Companies,9.99,9.98,40881,6/10/2022 20:00
FOCUS IMPACT ACQUISITION UNT (XNAS:FIACU),#FIELD!,10.02,10,3839,6/10/2022 19:25
"FIRST INTERSTATE BANCSYSTEM, INC. (XNAS:FIBK)",Banking Services,41.51,42.18,782074,7/10/2022 20:01
FAIR ISAAC CORPORATION (XNYS:FICO),Software & IT Services,402.2,413.82,218901,7/10/2022 23:00
Frontier Investment Corp (XNAS:FICV),Holding Companies,9.83,9.82,24120,7/10/2022 20:00
FRONTIER INVESTMENT UNT (XNAS:FICVU),#FIELD!,9.81,9.83,8604,7/10/2022 20:00
First Trust Energy Infra (XNYS:FIF),#FIELD!,13.43,13.78,52369,7/10/2022 23:00
"FIGS, INC. (XNYS:FIGS)",Specialty Retailers,8.56,8.85,4425457,7/10/2022 23:39
MARLIN TECHNOLOGY CORPORATION (XNAS:FINM),Holding Companies,9.98,9.97,79196,7/10/2022 19:59
MARLIN TECHNOLOGY UNT (XNAS:FINMU),#FIELD!,9.97,9.95,2274,4/10/2022 18:33
ANGEL OAK FINANCIAL STRATEGIES INCOME TERM TRUST (XNYS:FINS),Collective Investments,13.05,13.29,57930,7/10/2022 23:00
FinVolution Group (XNYS:FINV),Software & IT Services,4.6,4.8,354592,7/10/2022 23:00
FINWISE BANCORP (XNAS:FINW),Banking Services,8.7,8.9,42950,7/10/2022 20:00
FTAI INFRASTRUCTURE INC. (XNAS:FIP),Aerospace & Defense,2.57,2.64,1152486,7/10/2022 20:00
"FIDELITY NATIONAL INFORMATION SERVICES, INC. (XNYS:FIS)",Financial Technology (Fintech) & Infrastructure,77.1,77.65,5312343,7/10/2022 23:13
"FINANCIAL INSTITUTIONS, INC. (XNAS:FISI)",Banking Services,24.06,24.68,42003,7/10/2022 20:01
"FISERV, INC. (XNAS:FISV)",Professional & Commercial Services,98.7,99.08,4360414,7/10/2022 22:12
FIFTH THIRD BANCORP (XNAS:FITB),Banking Services,33.1,33.53,4466080,7/10/2022 22:17
FIFTH THIRD BANCORP (XNAS:FITBI),Banking Services,25.15,25.07,37031,7/10/2022 20:00
FIFTH THIRD BANCORP (XNAS:FITBO),Banking Services,20.97,21.18,15469,7/10/2022 20:00
FIFTH THIRD BANCORP (XNAS:FITBP),Banking Services,23.59,23.62,10308,7/10/2022 19:56
"FIVE BELOW, INC. (XNAS:FIVE)",Diversified Retail,140.1,144.61,1052302,7/10/2022 20:21
"FIVE9, INC. (XNAS:FIVN)",Software & IT Services,76.97,81.45,986885,7/10/2022 20:34
"COMFORT SYSTEMS USA, INC. (XNYS:FIX)",Construction & Engineering,100.76,103.31,172637,7/10/2022 23:00
"HOMOLOGY MEDICINES, INC. (XNAS:FIXX)",Biotechnology & Medical Research,1.46,1.51,240404,7/10/2022 23:52
NATIONAL BEVERAGE CORP. (XNAS:FIZZ),Beverages,39,39.78,231077,7/10/2022 21:14
FRANKLIN WIRELESS CORP. (XNAS:FKWL),Communications & Networking,2.92,3.02,8598,7/10/2022 20:00
"FOOT LOCKER, INC. (XNYS:FL)",Specialty Retailers,31.57,31.89,2436428,7/10/2022 23:00
Frazier Lifesciences Acquisition Corp (XNAS:FLAC),Holding Companies,9.97,9.97,41263,7/10/2022 20:00
FRAZIER LIFESCIENCES ACQUISITION UNT (XNAS:FLACU),#FIELD!,10.15,10.15,3546,3/10/2022 19:53
"FIRST LIGHT ACQUISITION GROUP, INC. (XNYS:FLAG)",Holding Companies,9.88,9.89,198311,7/10/2022 23:00
Flrty&Crumrine Tot Rtn (XNYS:FLC),#FIELD!,15.44,15.76,30124,7/10/2022 23:00
FLEX LTD. (XNAS:FLEX),Electronic Equipment & Parts,17.73,18.11,4271981,7/10/2022 22:03
FEUTUNE LIGHT ACQUISITION CORPORATION (XNAS:FLFV),Holding Companies,9.99,9.97,26946,4/10/2022 20:00
Flora Growth Corp. (XNAS:FLGC),Healthcare Providers & Services,0.68,0.78,505576,7/10/2022 23:58
"FULGENT GENETICS, INC. (XNAS:FLGT)",Healthcare Providers & Services,37.62,38.45,299740,7/10/2022 21:15
THE FIRST OF LONG ISLAND CORPORATION (XNAS:FLIC),Banking Services,17.27,17.75,59388,7/10/2022 20:01
FLJ Group Limited (XNAS:FLJ),Real Estate Operations,2,2,5063,7/10/2022 20:00
"FULL HOUSE RESORTS, INC. (XNAS:FLL)",Hotels & Entertainment Services,5.56,5.77,90764,7/10/2022 21:37
FLAME ACQUISITION CORP. (XNYS:FLME),Holding Companies,9.86,9.86,157180,7/10/2022 23:00
Fluence Energy Inc (XNAS:FLNC),"Machinery, Equipment & Components",14.4,15.25,981798,7/10/2022 20:51
FLEX LNG LTD. (XNYS:FLNG),Oil & Gas Related Equipment and Services,30.22,29.9,631050,7/10/2022 23:59
"FLUENT, INC. (XNAS:FLNT)",Media & Publishing,1.36,1.41,91833,7/10/2022 20:44
"FLOWERS FOODS, INC. (XNYS:FLO)",Food & Tobacco,24.55,24.66,1273091,7/10/2022 23:00
FLUOR CORPORATION. (XNYS:FLR),Construction & Engineering,28.36,28.93,1772827,7/10/2022 23:00
FLOWSERVE CORPORATION (XNYS:FLS),"Machinery, Equipment & Components",25.63,26.51,1474514,7/10/2022 23:00
"FLEETCOR TECHNOLOGIES, INC. (XNYS:FLT)",Professional & Commercial Services,179.59,182.24,639800,7/10/2022 23:13
"FLUX POWER HOLDINGS, INC. (XNAS:FLUX)","Machinery, Equipment & Components",3.01,3.09,40162,7/10/2022 20:00
"1-800-FLOWERS.COM, INC. (XNAS:FLWS)",Specialty Retailers,5.9,6.17,1034756,7/10/2022 21:41
"Flexsteel Industries, Inc. (XNAS:FLXS)",Household Goods,14.81,15.62,17796,7/10/2022 20:00
Soar Technology Acquisition Corp (XNYS:FLYA),Holding Companies,10.29,10.29,55345,7/10/2022 23:00
FLYWIRE CORPORATION (XNAS:FLYW),Professional & Commercial Services,22.71,23.86,1052978,7/10/2022 20:00
"FARMERS & MERCHANTS BANCORP, INC. (XNAS:FMAO)",Banking Services,26.83,27.25,27940,7/10/2022 20:01
